time,weathercode,temperature_2m_max,temperature_2m_min,temperature_2m_mean,apparent_temperature_max,apparent_temperature_min,apparent_temperature_mean,sunrise,sunset,shortwave_radiation_sum,precipitation_sum,rain_sum,snowfall_sum,precipitation_hours,windspeed_10m_max,windgusts_10m_max,winddirection_10m_dominant,et0_fao_evapotranspiration,latitude,longitude,elevation,country,city,date,month,year,rainfall_lag1
1/2/2010,51,27.3,24.3,25.7,28.8,26.6,27.6,6:19:00 AM,5:58:00 PM,15.31,2.0,2.0,0,11,22.5,36.0,36,3.77,8.599998,81.20001,7,Sri Lanka,Trincomalee,2010-01-02,1,2010,0.0
1/3/2010,51,26.3,24.2,25.2,28.4,26.0,27.1,6:20:00 AM,5:58:00 PM,15.44,1.4,1.4,0,7,22.7,34.2,26,3.52,8.599998,81.20001,7,Sri Lanka,Trincomalee,2010-01-03,1,2010,2.0
1/4/2010,2,26.5,23.5,24.9,28.8,24.5,26.3,6:20:00 AM,5:59:00 PM,18.62,0.0,0.0,0,0,19.5,33.1,9,4.32,8.599998,81.20001,7,Sri Lanka,Trincomalee,2010-01-04,1,2010,1.4
1/5/2010,3,26.8,23.4,25.1,28.6,24.7,25.9,6:21:00 AM,5:59:00 PM,22.31,0.0,0.0,0,0,20.9,34.2,7,5.33,8.599998,81.20001,7,Sri Lanka,Trincomalee,2010-01-05,1,2010,0.0
1/6/2010,3,27.1,24.5,25.7,27.8,25.4,26.4,6:21:00 AM,6:00:00 PM,16.78,0.0,0.0,0,0,22.1,34.6,23,4.76,8.599998,81.20001,7,Sri Lanka,Trincomalee,2010-01-06,1,2010,0.0
1/7/2010,63,27.5,23.3,25.3,28.3,25.5,26.9,6:21:00 AM,6:00:00 PM,13.32,15.6,15.6,0,12,23.1,37.1,356,3.58,8.599998,81.20001,7,Sri Lanka,Trincomalee,2010-01-07,1,2010,0.0
1/8/2010,53,26.0,23.4,24.9,30.6,27.2,28.9,6:22:00 AM,6:01:00 PM,8.87,1.8,1.8,0,8,14.1,31.7,80,1.85,8.599998,81.20001,7,Sri Lanka,Trincomalee,2010-01-08,1,2010,15.6
1/9/2010,53,28.2,24.4,26.2,33.3,28.7,30.6,6:22:00 AM,6:01:00 PM,19.17,2.2,2.2,0,5,17.3,28.1,118,3.65,8.599998,81.20001,7,Sri Lanka,Trincomalee,2010-01-09,1,2010,1.8
1/10/2010,51,27.9,24.3,25.9,33.1,28.8,30.6,6:22:00 AM,6:02:00 PM,19.44,0.5,0.5,0,3,15.0,27.4,90,3.64,8.599998,81.20001,7,Sri Lanka,Trincomalee,2010-01-10,1,2010,2.2
1/11/2010,51,28.2,23.9,26.1,35.0,28.7,31.0,6:22:00 AM,6:02:00 PM,20.2,0.5,0.5,0,5,11.5,21.2,83,3.9,8.599998,81.20001,7,Sri Lanka,Trincomalee,2010-01-11,1,2010,0.5
1/12/2010,61,28.0,23.8,25.6,34.0,28.4,30.4,6:23:00 AM,6:03:00 PM,18.49,7.6,7.6,0,12,11.1,20.9,40,3.54,8.599998,81.20001,7,Sri Lanka,Trincomalee,2010-01-12,1,2010,0.5
1/13/2010,51,27.8,24.8,26.4,33.4,29.1,30.7,6:23:00 AM,6:03:00 PM,18.17,1.2,1.2,0,9,15.3,24.1,80,3.68,8.599998,81.20001,7,Sri Lanka,Trincomalee,2010-01-13,1,2010,7.6
1/14/2010,51,28.0,25.0,26.5,31.7,27.7,29.7,6:23:00 AM,6:04:00 PM,19.18,0.9,0.9,0,4,20.0,32.8,61,4.04,8.599998,81.20001,7,Sri Lanka,Trincomalee,2010-01-14,1,2010,1.2
1/15/2010,2,27.1,24.9,26.1,30.6,27.2,28.1,6:24:00 AM,6:04:00 PM,19.33,0.0,0.0,0,0,19.4,31.3,41,4.54,8.599998,81.20001,7,Sri Lanka,Trincomalee,2010-01-15,1,2010,0.9
1/16/2010,53,26.9,24.8,25.6,30.1,27.2,28.3,6:24:00 AM,6:05:00 PM,16.06,8.2,8.2,0,21,22.4,37.8,46,3.35,8.599998,81.20001,7,Sri Lanka,Trincomalee,2010-01-16,1,2010,0.0
1/17/2010,51,27.4,25.1,26.2,29.2,27.2,28.0,6:24:00 AM,6:05:00 PM,17.18,1.0,1.0,0,6,25.8,41.0,31,4.15,8.599998,81.20001,7,Sri Lanka,Trincomalee,2010-01-17,1,2010,8.2
1/18/2010,51,26.5,25.1,25.6,29.3,27.0,28.0,6:24:00 AM,6:06:00 PM,14.09,3.1,3.1,0,17,20.2,32.8,37,3.34,8.599998,81.20001,7,Sri Lanka,Trincomalee,2010-01-18,1,2010,1.0
1/19/2010,2,27.5,24.9,26.0,30.3,26.3,27.9,6:24:00 AM,6:06:00 PM,18.8,0.0,0.0,0,0,21.3,33.8,36,4.45,8.599998,81.20001,7,Sri Lanka,Trincomalee,2010-01-19,1,2010,3.1
1/20/2010,2,27.5,24.5,25.9,29.7,25.8,27.4,6:25:00 AM,6:06:00 PM,19.55,0.0,0.0,0,0,19.2,31.7,29,4.74,8.599998,81.20001,7,Sri Lanka,Trincomalee,2010-01-20,1,2010,0.0
1/21/2010,2,27.0,24.4,25.4,28.7,25.8,26.7,6:25:00 AM,6:07:00 PM,18.86,0.0,0.0,0,0,20.9,34.6,24,4.49,8.599998,81.20001,7,Sri Lanka,Trincomalee,2010-01-21,1,2010,0.0
1/22/2010,1,27.1,23.8,25.2,28.9,25.0,26.4,6:25:00 AM,6:07:00 PM,21.19,0.0,0.0,0,0,21.0,34.2,16,4.87,8.599998,81.20001,7,Sri Lanka,Trincomalee,2010-01-22,1,2010,0.0
1/23/2010,2,27.7,23.9,25.8,29.4,24.9,27.0,6:25:00 AM,6:08:00 PM,21.27,0.0,0.0,0,0,16.6,29.2,36,5.12,8.599998,81.20001,7,Sri Lanka,Trincomalee,2010-01-23,1,2010,0.0
1/24/2010,51,28.3,23.7,25.8,30.4,26.2,27.8,6:25:00 AM,6:08:00 PM,20.85,0.4,0.4,0,3,14.2,26.6,34,4.83,8.599998,81.20001,7,Sri Lanka,Trincomalee,2010-01-24,1,2010,0.0
1/25/2010,51,27.6,24.1,25.8,31.2,27.4,28.8,6:25:00 AM,6:09:00 PM,19.81,0.2,0.2,0,2,17.2,28.8,27,4.09,8.599998,81.20001,7,Sri Lanka,Trincomalee,2010-01-25,1,2010,0.4
1/26/2010,51,27.8,24.1,25.9,31.4,27.4,28.9,6:25:00 AM,6:09:00 PM,20.46,0.7,0.7,0,5,18.2,30.2,35,4.22,8.599998,81.20001,7,Sri Lanka,Trincomalee,2010-01-26,1,2010,0.2
1/27/2010,51,27.2,24.4,25.7,31.4,27.6,28.7,6:25:00 AM,6:09:00 PM,17.68,3.9,3.9,0,22,22.9,36.7,42,3.45,8.599998,81.20001,7,Sri Lanka,Trincomalee,2010-01-27,1,2010,0.7
1/28/2010,51,27.8,25.2,26.4,30.9,27.2,28.7,6:25:00 AM,6:10:00 PM,20.0,0.6,0.6,0,4,24.2,38.5,43,4.37,8.599998,81.20001,7,Sri Lanka,Trincomalee,2010-01-28,1,2010,3.9
1/29/2010,51,27.6,25.2,26.1,29.9,26.9,27.8,6:25:00 AM,6:10:00 PM,17.24,1.4,1.4,0,7,24.7,38.5,32,4.27,8.599998,81.20001,7,Sri Lanka,Trincomalee,2010-01-29,1,2010,0.6
1/30/2010,51,27.3,25.3,26.1,28.6,26.7,27.6,6:25:00 AM,6:10:00 PM,13.33,1.5,1.5,0,5,25.3,40.0,28,3.79,8.599998,81.20001,7,Sri Lanka,Trincomalee,2010-01-30,1,2010,1.4
1/31/2010,51,27.3,25.6,26.3,29.1,27.0,28.0,6:25:00 AM,6:11:00 PM,15.59,0.3,0.3,0,3,23.5,37.1,22,4.14,8.599998,81.20001,7,Sri Lanka,Trincomalee,2010-01-31,1,2010,1.5
2/1/2010,51,28.0,24.9,26.2,30.4,27.0,28.3,6:25:00 AM,6:11:00 PM,16.42,0.7,0.7,0,4,20.9,33.8,24,4.08,8.599998,81.20001,7,Sri Lanka,Trincomalee,2010-02-01,2,2010,0.3
2/2/2010,51,26.8,24.6,25.6,28.3,26.5,27.2,6:25:00 AM,6:11:00 PM,16.0,2.0,2.0,0,8,26.1,43.2,30,3.82,8.599998,81.20001,7,Sri Lanka,Trincomalee,2010-02-02,2,2010,0.7
2/3/2010,2,26.9,24.4,25.5,28.4,26.2,27.1,6:25:00 AM,6:12:00 PM,18.67,0.0,0.0,0,0,23.8,38.2,31,4.26,8.599998,81.20001,7,Sri Lanka,Trincomalee,2010-02-03,2,2010,2.0
2/4/2010,3,27.2,24.4,25.5,29.3,26.1,27.0,6:25:00 AM,6:12:00 PM,19.09,0.0,0.0,0,0,19.2,31.3,32,4.56,8.599998,81.20001,7,Sri Lanka,Trincomalee,2010-02-04,2,2010,0.0
2/5/2010,2,27.7,24.8,26.0,29.1,25.9,27.1,6:25:00 AM,6:12:00 PM,17.69,0.0,0.0,0,0,20.2,32.8,31,4.75,8.599998,81.20001,7,Sri Lanka,Trincomalee,2010-02-05,2,2010,0.0
2/6/2010,3,27.6,24.6,26.1,29.6,25.3,26.8,6:25:00 AM,6:12:00 PM,20.84,0.0,0.0,0,0,24.7,38.5,44,5.51,8.599998,81.20001,7,Sri Lanka,Trincomalee,2010-02-06,2,2010,0.0
2/7/2010,3,27.9,24.3,25.9,29.0,25.1,26.4,6:25:00 AM,6:13:00 PM,19.36,0.0,0.0,0,0,23.2,37.1,40,5.31,8.599998,81.20001,7,Sri Lanka,Trincomalee,2010-02-07,2,2010,0.0
2/8/2010,3,27.4,24.2,25.8,29.0,25.2,27.1,6:24:00 AM,6:13:00 PM,21.64,0.0,0.0,0,0,20.5,33.1,39,5.08,8.599998,81.20001,7,Sri Lanka,Trincomalee,2010-02-08,2,2010,0.0
2/9/2010,3,27.7,24.4,26.2,29.2,26.3,28.5,6:24:00 AM,6:13:00 PM,13.16,0.0,0.0,0,0,15.5,25.2,54,3.59,8.599998,81.20001,7,Sri Lanka,Trincomalee,2010-02-09,2,2010,0.0
2/10/2010,51,27.9,25.4,26.6,31.2,28.3,29.3,6:24:00 AM,6:13:00 PM,17.84,0.6,0.6,0,4,20.1,33.1,45,4.1,8.599998,81.20001,7,Sri Lanka,Trincomalee,2010-02-10,2,2010,0.0
2/11/2010,3,28.3,25.4,26.6,32.0,28.1,29.5,6:24:00 AM,6:14:00 PM,17.52,0.0,0.0,0,0,17.6,29.5,41,3.98,8.599998,81.20001,7,Sri Lanka,Trincomalee,2010-02-11,2,2010,0.6
2/12/2010,3,27.5,25.4,26.4,30.1,28.3,29.1,6:24:00 AM,6:14:00 PM,10.63,0.0,0.0,0,0,19.5,31.3,41,2.95,8.599998,81.20001,7,Sri Lanka,Trincomalee,2010-02-12,2,2010,0.0
2/13/2010,2,28.6,24.8,26.6,32.8,28.1,29.6,6:23:00 AM,6:14:00 PM,19.36,0.0,0.0,0,0,19.1,31.7,44,4.26,8.599998,81.20001,7,Sri Lanka,Trincomalee,2010-02-13,2,2010,0.0
2/14/2010,2,28.5,24.6,26.1,33.1,27.4,29.1,6:23:00 AM,6:14:00 PM,22.68,0.0,0.0,0,0,15.5,27.7,66,4.89,8.599998,81.20001,7,Sri Lanka,Trincomalee,2010-02-14,2,2010,0.0
2/15/2010,2,28.9,24.6,26.8,32.8,27.4,29.2,6:23:00 AM,6:14:00 PM,22.78,0.0,0.0,0,0,15.9,28.4,78,5.34,8.599998,81.20001,7,Sri Lanka,Trincomalee,2010-02-15,2,2010,0.0
2/16/2010,53,27.5,25.6,26.6,29.9,28.6,29.5,6:23:00 AM,6:15:00 PM,10.54,2.9,2.9,0,13,20.2,32.8,47,2.92,8.599998,81.20001,7,Sri Lanka,Trincomalee,2010-02-16,2,2010,0.0
2/17/2010,51,28.5,25.2,26.8,32.1,29.0,30.2,6:22:00 AM,6:15:00 PM,19.2,1.4,1.4,0,8,23.4,37.4,62,4.02,8.599998,81.20001,7,Sri Lanka,Trincomalee,2010-02-17,2,2010,2.9
2/18/2010,3,28.7,24.8,26.4,34.1,28.0,30.0,6:22:00 AM,6:15:00 PM,23.86,0.0,0.0,0,0,13.4,24.5,79,4.96,8.599998,81.20001,7,Sri Lanka,Trincomalee,2010-02-18,2,2010,1.4
2/19/2010,2,29.3,24.7,26.7,34.3,27.8,30.0,6:22:00 AM,6:15:00 PM,24.21,0.0,0.0,0,0,14.8,25.2,85,5.32,8.599998,81.20001,7,Sri Lanka,Trincomalee,2010-02-19,2,2010,0.0
2/20/2010,2,30.0,25.4,27.3,34.9,28.5,30.7,6:22:00 AM,6:15:00 PM,22.27,0.0,0.0,0,0,15.8,25.6,83,5.07,8.599998,81.20001,7,Sri Lanka,Trincomalee,2010-02-20,2,2010,0.0
2/21/2010,2,29.5,25.5,27.2,34.1,28.8,30.4,6:21:00 AM,6:15:00 PM,24.35,0.0,0.0,0,0,16.0,26.6,81,5.37,8.599998,81.20001,7,Sri Lanka,Trincomalee,2010-02-21,2,2010,0.0
2/22/2010,1,29.5,25.8,27.3,34.1,28.9,30.5,6:21:00 AM,6:15:00 PM,24.66,0.0,0.0,0,0,17.9,29.9,82,5.43,8.599998,81.20001,7,Sri Lanka,Trincomalee,2010-02-22,2,2010,0.0
2/23/2010,2,29.8,24.7,26.9,34.5,28.2,30.4,6:21:00 AM,6:15:00 PM,23.05,0.0,0.0,0,0,13.3,24.1,107,5.06,8.599998,81.20001,7,Sri Lanka,Trincomalee,2010-02-23,2,2010,0.0
2/24/2010,0,30.1,24.3,26.9,35.0,28.1,30.3,6:20:00 AM,6:15:00 PM,25.32,0.0,0.0,0,0,18.7,26.6,125,5.6,8.599998,81.20001,7,Sri Lanka,Trincomalee,2010-02-24,2,2010,0.0
2/25/2010,1,30.5,23.9,27.1,36.3,27.9,30.9,6:20:00 AM,6:15:00 PM,24.84,0.0,0.0,0,0,18.1,29.5,104,5.47,8.599998,81.20001,7,Sri Lanka,Trincomalee,2010-02-25,2,2010,0.0
2/26/2010,1,30.3,24.9,27.1,35.8,28.2,30.8,6:19:00 AM,6:16:00 PM,24.8,0.0,0.0,0,0,16.7,27.7,65,5.45,8.599998,81.20001,7,Sri Lanka,Trincomalee,2010-02-26,2,2010,0.0
2/27/2010,1,29.7,24.6,27.1,34.0,28.1,30.2,6:19:00 AM,6:16:00 PM,24.57,0.0,0.0,0,0,16.8,28.4,80,5.45,8.599998,81.20001,7,Sri Lanka,Trincomalee,2010-02-27,2,2010,0.0
2/28/2010,3,30.3,25.0,27.2,35.1,28.8,30.9,6:19:00 AM,6:16:00 PM,25.83,0.0,0.0,0,0,14.1,25.2,92,5.56,8.599998,81.20001,7,Sri Lanka,Trincomalee,2010-02-28,2,2010,0.0
3/1/2010,3,29.3,24.1,26.5,33.4,27.0,29.6,6:18:00 AM,6:16:00 PM,24.56,0.0,0.0,0,0,14.5,25.6,79,5.24,8.599998,81.20001,7,Sri Lanka,Trincomalee,2010-03-01,3,2010,0.0
3/2/2010,2,28.9,23.4,26.2,32.8,26.5,28.9,6:18:00 AM,6:16:00 PM,25.31,0.0,0.0,0,0,13.7,24.5,67,5.45,8.599998,81.20001,7,Sri Lanka,Trincomalee,2010-03-02,3,2010,0.0
3/3/2010,1,29.9,24.1,26.6,34.5,27.1,29.6,6:17:00 AM,6:16:00 PM,26.43,0.0,0.0,0,0,15.7,25.2,93,5.77,8.599998,81.20001,7,Sri Lanka,Trincomalee,2010-03-03,3,2010,0.0
3/4/2010,1,31.4,23.8,27.6,36.9,27.6,31.6,6:17:00 AM,6:16:00 PM,24.08,0.0,0.0,0,0,18.4,32.8,131,5.34,8.599998,81.20001,7,Sri Lanka,Trincomalee,2010-03-04,3,2010,0.0
3/5/2010,1,31.9,25.1,28.3,37.9,29.4,32.3,6:16:00 AM,6:16:00 PM,24.27,0.0,0.0,0,0,18.7,30.2,136,5.63,8.599998,81.20001,7,Sri Lanka,Trincomalee,2010-03-05,3,2010,0.0
3/6/2010,1,32.3,25.4,28.6,37.9,28.1,32.2,6:16:00 AM,6:16:00 PM,25.25,0.0,0.0,0,0,22.4,36.7,160,6.09,8.599998,81.20001,7,Sri Lanka,Trincomalee,2010-03-06,3,2010,0.0
3/7/2010,1,33.0,25.5,28.5,39.1,28.1,32.7,6:15:00 AM,6:16:00 PM,25.07,0.0,0.0,0,0,21.4,35.3,68,5.72,8.599998,81.20001,7,Sri Lanka,Trincomalee,2010-03-07,3,2010,0.0
3/8/2010,1,31.3,25.9,28.3,36.5,30.3,32.2,6:15:00 AM,6:16:00 PM,23.63,0.0,0.0,0,0,18.0,30.2,116,5.46,8.599998,81.20001,7,Sri Lanka,Trincomalee,2010-03-08,3,2010,0.0
3/9/2010,2,31.2,26.2,28.3,35.9,29.5,31.8,6:15:00 AM,6:16:00 PM,23.53,0.0,0.0,0,0,18.4,31.7,101,5.53,8.599998,81.20001,7,Sri Lanka,Trincomalee,2010-03-09,3,2010,0.0
3/10/2010,51,30.8,26.4,28.5,34.6,29.2,31.2,6:14:00 AM,6:16:00 PM,24.18,0.2,0.2,0,1,20.2,34.9,81,6.03,8.599998,81.20001,7,Sri Lanka,Trincomalee,2010-03-10,3,2010,0.0
3/11/2010,51,30.8,26.9,28.6,34.8,29.1,31.3,6:14:00 AM,6:16:00 PM,23.42,0.7,0.7,0,4,21.9,35.6,77,5.99,8.599998,81.20001,7,Sri Lanka,Trincomalee,2010-03-11,3,2010,0.2
3/12/2010,2,30.7,27.3,28.6,34.3,30.0,31.6,6:13:00 AM,6:16:00 PM,21.47,0.0,0.0,0,0,21.0,36.4,68,5.45,8.599998,81.20001,7,Sri Lanka,Trincomalee,2010-03-12,3,2010,0.7
3/13/2010,51,30.2,26.9,28.5,34.0,31.0,32.2,6:13:00 AM,6:16:00 PM,20.59,0.9,0.9,0,7,22.7,37.1,70,4.93,8.599998,81.20001,7,Sri Lanka,Trincomalee,2010-03-13,3,2010,0.0
3/14/2010,2,31.3,26.0,28.4,36.8,31.0,32.9,6:12:00 AM,6:16:00 PM,25.12,0.0,0.0,0,0,16.7,28.4,65,5.45,8.599998,81.20001,7,Sri Lanka,Trincomalee,2010-03-14,3,2010,0.9
3/15/2010,2,31.6,25.1,28.0,37.1,29.5,32.1,6:12:00 AM,6:16:00 PM,25.97,0.0,0.0,0,0,15.5,26.6,112,5.77,8.599998,81.20001,7,Sri Lanka,Trincomalee,2010-03-15,3,2010,0.0
3/16/2010,1,31.6,24.9,27.9,36.8,29.4,31.9,6:11:00 AM,6:16:00 PM,26.38,0.0,0.0,0,0,16.5,30.2,94,5.87,8.599998,81.20001,7,Sri Lanka,Trincomalee,2010-03-16,3,2010,0.0
3/17/2010,2,30.8,26.1,28.4,34.6,29.7,31.4,6:10:00 AM,6:16:00 PM,24.71,0.0,0.0,0,0,17.6,29.9,69,6.07,8.599998,81.20001,7,Sri Lanka,Trincomalee,2010-03-17,3,2010,0.0
3/18/2010,51,30.4,26.9,28.4,32.8,29.4,31.0,6:10:00 AM,6:15:00 PM,21.52,0.6,0.6,0,4,23.6,38.2,55,5.45,8.599998,81.20001,7,Sri Lanka,Trincomalee,2010-03-18,3,2010,0.0
3/19/2010,51,30.9,26.8,28.5,35.1,30.7,32.3,6:09:00 AM,6:15:00 PM,23.88,0.1,0.1,0,1,20.9,35.3,47,5.45,8.599998,81.20001,7,Sri Lanka,Trincomalee,2010-03-19,3,2010,0.6
3/20/2010,2,31.4,26.3,28.5,36.9,31.5,33.2,6:09:00 AM,6:15:00 PM,25.37,0.0,0.0,0,0,16.0,28.8,54,5.43,8.599998,81.20001,7,Sri Lanka,Trincomalee,2010-03-20,3,2010,0.1
3/21/2010,2,31.9,25.5,28.4,38.1,31.0,33.4,6:08:00 AM,6:15:00 PM,25.79,0.0,0.0,0,0,17.2,29.5,88,5.6,8.599998,81.20001,7,Sri Lanka,Trincomalee,2010-03-21,3,2010,0.0
3/22/2010,2,32.0,25.7,28.5,38.3,30.8,33.4,6:08:00 AM,6:15:00 PM,24.88,0.0,0.0,0,0,16.3,28.4,115,5.46,8.599998,81.20001,7,Sri Lanka,Trincomalee,2010-03-22,3,2010,0.0
3/23/2010,2,32.1,26.0,28.5,37.8,29.7,32.4,6:07:00 AM,6:15:00 PM,26.51,0.0,0.0,0,0,18.1,30.2,119,6.14,8.599998,81.20001,7,Sri Lanka,Trincomalee,2010-03-23,3,2010,0.0
3/24/2010,2,30.9,25.8,28.4,35.8,30.0,32.2,6:07:00 AM,6:15:00 PM,22.49,0.0,0.0,0,0,15.6,27.7,125,5.3,8.599998,81.20001,7,Sri Lanka,Trincomalee,2010-03-24,3,2010,0.0
3/25/2010,51,32.1,27.2,29.2,37.9,30.9,33.6,6:06:00 AM,6:15:00 PM,23.76,0.1,0.1,0,1,19.4,34.6,115,5.61,8.599998,81.20001,7,Sri Lanka,Trincomalee,2010-03-25,3,2010,0.0
3/26/2010,51,32.6,26.8,29.1,38.4,31.4,34.0,6:06:00 AM,6:15:00 PM,23.88,1.2,1.2,0,4,17.4,31.0,129,5.41,8.599998,81.20001,7,Sri Lanka,Trincomalee,2010-03-26,3,2010,0.1
3/27/2010,63,32.5,25.4,27.6,39.3,30.1,32.8,6:05:00 AM,6:15:00 PM,21.54,16.5,16.5,0,11,18.5,34.9,175,4.57,8.599998,81.20001,7,Sri Lanka,Trincomalee,2010-03-27,3,2010,1.2
3/28/2010,51,29.8,25.9,27.9,36.2,31.3,33.3,6:05:00 AM,6:15:00 PM,16.06,0.3,0.3,0,1,12.1,20.5,138,3.55,8.599998,81.20001,7,Sri Lanka,Trincomalee,2010-03-28,3,2010,16.5
3/29/2010,61,30.8,26.3,28.0,39.0,31.3,33.9,6:04:00 AM,6:15:00 PM,21.83,4.5,4.5,0,7,10.7,19.4,181,4.58,8.599998,81.20001,7,Sri Lanka,Trincomalee,2010-03-29,3,2010,0.3
3/30/2010,51,31.1,26.2,28.1,38.5,30.7,33.3,6:04:00 AM,6:15:00 PM,23.94,0.9,0.9,0,5,14.8,26.6,182,5.11,8.599998,81.20001,7,Sri Lanka,Trincomalee,2010-03-30,3,2010,4.5
3/31/2010,53,33.2,26.1,29.0,39.7,30.3,34.0,6:03:00 AM,6:15:00 PM,24.9,0.9,0.9,0,2,14.3,26.3,225,5.59,8.599998,81.20001,7,Sri Lanka,Trincomalee,2010-03-31,3,2010,0.9
4/1/2010,2,33.6,26.5,29.6,40.5,30.2,34.5,6:02:00 AM,6:15:00 PM,26.33,0.0,0.0,0,0,18.3,28.1,171,6.1,8.599998,81.20001,7,Sri Lanka,Trincomalee,2010-04-01,4,2010,0.9
4/2/2010,1,32.7,26.9,29.4,41.0,31.9,34.9,6:02:00 AM,6:15:00 PM,26.33,0.0,0.0,0,0,17.4,28.1,117,5.89,8.599998,81.20001,7,Sri Lanka,Trincomalee,2010-04-02,4,2010,0.0
4/3/2010,51,32.1,26.9,29.1,38.9,32.4,34.4,6:01:00 AM,6:15:00 PM,26.04,0.1,0.1,0,1,16.3,25.6,121,5.71,8.599998,81.20001,7,Sri Lanka,Trincomalee,2010-04-03,4,2010,0.0
4/4/2010,51,31.1,26.6,28.7,37.2,31.8,33.8,6:01:00 AM,6:14:00 PM,23.4,0.2,0.2,0,2,17.0,25.9,125,5.12,8.599998,81.20001,7,Sri Lanka,Trincomalee,2010-04-04,4,2010,0.1
4/5/2010,51,31.6,26.7,29.0,38.6,32.6,34.8,6:00:00 AM,6:14:00 PM,24.09,0.1,0.1,0,1,12.8,24.1,126,5.18,8.599998,81.20001,7,Sri Lanka,Trincomalee,2010-04-05,4,2010,0.2
4/6/2010,51,31.1,26.6,28.5,36.6,32.2,33.6,6:00:00 AM,6:14:00 PM,14.21,0.5,0.5,0,3,12.7,25.2,125,3.35,8.599998,81.20001,7,Sri Lanka,Trincomalee,2010-04-06,4,2010,0.1
4/7/2010,63,30.7,25.7,28.0,36.3,30.0,32.8,5:59:00 AM,6:14:00 PM,18.94,11.4,11.4,0,15,14.3,26.6,101,4.17,8.599998,81.20001,7,Sri Lanka,Trincomalee,2010-04-07,4,2010,0.5
4/8/2010,51,31.1,25.9,28.6,37.1,30.8,33.9,5:59:00 AM,6:14:00 PM,22.46,0.5,0.5,0,4,17.4,31.3,120,4.72,8.599998,81.20001,7,Sri Lanka,Trincomalee,2010-04-08,4,2010,11.4
4/9/2010,2,31.0,26.3,28.7,37.1,32.8,34.2,5:58:00 AM,6:14:00 PM,23.66,0.0,0.0,0,0,16.0,27.7,111,5.04,8.599998,81.20001,7,Sri Lanka,Trincomalee,2010-04-09,4,2010,0.5
4/10/2010,3,32.3,26.7,29.3,39.9,32.2,34.5,5:58:00 AM,6:14:00 PM,23.49,0.0,0.0,0,0,19.4,29.2,147,5.43,8.599998,81.20001,7,Sri Lanka,Trincomalee,2010-04-10,4,2010,0.0
4/11/2010,3,32.2,27.4,29.8,38.5,33.0,34.9,5:57:00 AM,6:14:00 PM,24.02,0.0,0.0,0,0,20.2,31.0,147,5.61,8.599998,81.20001,7,Sri Lanka,Trincomalee,2010-04-11,4,2010,0.0
4/12/2010,51,33.3,27.6,29.9,41.1,33.0,35.5,5:57:00 AM,6:14:00 PM,24.69,0.1,0.1,0,1,16.1,26.3,171,5.73,8.599998,81.20001,7,Sri Lanka,Trincomalee,2010-04-12,4,2010,0.0
4/13/2010,51,33.7,27.4,30.1,41.1,33.0,35.7,5:56:00 AM,6:14:00 PM,24.98,1.0,1.0,0,4,15.9,23.0,145,5.77,8.599998,81.20001,7,Sri Lanka,Trincomalee,2010-04-13,4,2010,0.1
4/14/2010,53,33.1,27.2,29.4,39.1,32.3,34.9,5:56:00 AM,6:14:00 PM,20.61,1.5,1.5,0,5,15.5,23.8,196,4.64,8.599998,81.20001,7,Sri Lanka,Trincomalee,2010-04-14,4,2010,1.0
4/15/2010,51,32.6,27.0,29.7,39.6,32.4,34.8,5:55:00 AM,6:14:00 PM,24.35,0.7,0.7,0,3,17.7,28.1,128,5.71,8.599998,81.20001,7,Sri Lanka,Trincomalee,2010-04-15,4,2010,1.5
4/16/2010,61,32.3,26.9,28.8,39.6,31.6,34.4,5:55:00 AM,6:14:00 PM,22.95,2.7,2.7,0,4,13.2,24.5,165,5.06,8.599998,81.20001,7,Sri Lanka,Trincomalee,2010-04-16,4,2010,0.7
4/17/2010,51,31.5,26.6,28.7,39.0,32.0,34.2,5:54:00 AM,6:14:00 PM,21.03,0.2,0.2,0,1,17.6,28.8,171,4.56,8.599998,81.20001,7,Sri Lanka,Trincomalee,2010-04-17,4,2010,2.7
4/18/2010,51,32.4,26.5,29.2,39.4,31.9,34.5,5:54:00 AM,6:14:00 PM,24.5,0.1,0.1,0,1,17.0,31.0,153,5.52,8.599998,81.20001,7,Sri Lanka,Trincomalee,2010-04-18,4,2010,0.2
4/19/2010,53,32.9,26.9,29.5,41.4,31.4,35.1,5:54:00 AM,6:14:00 PM,24.78,1.1,1.1,0,2,11.8,24.1,186,5.56,8.599998,81.20001,7,Sri Lanka,Trincomalee,2010-04-19,4,2010,0.1
4/20/2010,51,33.9,27.1,30.0,41.1,32.1,34.9,5:53:00 AM,6:14:00 PM,25.17,0.1,0.1,0,1,18.6,29.2,168,6.08,8.599998,81.20001,7,Sri Lanka,Trincomalee,2010-04-20,4,2010,1.1
4/21/2010,2,33.8,27.3,30.3,40.2,31.7,35.2,5:53:00 AM,6:14:00 PM,24.8,0.0,0.0,0,0,12.9,26.3,196,5.94,8.599998,81.20001,7,Sri Lanka,Trincomalee,2010-04-21,4,2010,0.1
4/22/2010,51,34.6,27.4,30.2,42.0,31.5,35.7,5:52:00 AM,6:14:00 PM,25.12,0.2,0.2,0,1,15.5,28.1,185,5.83,8.599998,81.20001,7,Sri Lanka,Trincomalee,2010-04-22,4,2010,0.0
4/23/2010,2,33.0,26.8,29.4,40.5,31.4,34.9,5:52:00 AM,6:14:00 PM,24.36,0.0,0.0,0,0,16.9,27.4,259,5.53,8.599998,81.20001,7,Sri Lanka,Trincomalee,2010-04-23,4,2010,0.2
4/24/2010,63,32.9,26.3,28.5,40.5,31.0,33.7,5:51:00 AM,6:14:00 PM,21.81,12.7,12.7,0,4,17.8,27.4,241,4.82,8.599998,81.20001,7,Sri Lanka,Trincomalee,2010-04-24,4,2010,0.0
4/25/2010,53,31.7,26.4,29.4,37.6,31.1,34.4,5:51:00 AM,6:14:00 PM,20.63,1.3,1.3,0,4,14.2,20.9,164,4.84,8.599998,81.20001,7,Sri Lanka,Trincomalee,2010-04-25,4,2010,12.7
4/26/2010,53,31.1,26.4,28.5,37.5,31.5,34.3,5:51:00 AM,6:14:00 PM,22.14,3.0,3.0,0,5,15.6,27.4,141,4.57,8.599998,81.20001,7,Sri Lanka,Trincomalee,2010-04-26,4,2010,1.3
4/27/2010,51,31.6,26.4,29.0,38.6,31.5,35.1,5:50:00 AM,6:14:00 PM,23.36,0.2,0.2,0,1,13.9,23.0,97,4.9,8.599998,81.20001,7,Sri Lanka,Trincomalee,2010-04-27,4,2010,3.0
4/28/2010,1,31.9,27.4,29.5,38.9,33.0,34.9,5:50:00 AM,6:14:00 PM,23.8,0.0,0.0,0,0,14.4,26.6,128,5.39,8.599998,81.20001,7,Sri Lanka,Trincomalee,2010-04-28,4,2010,0.2
4/29/2010,61,31.7,26.2,29.0,37.4,30.8,33.8,5:50:00 AM,6:14:00 PM,22.46,3.5,3.5,0,6,19.4,33.5,127,5.04,8.599998,81.20001,7,Sri Lanka,Trincomalee,2010-04-29,4,2010,0.0
4/30/2010,61,31.0,25.5,27.8,37.2,29.9,33.1,5:49:00 AM,6:14:00 PM,21.36,12.6,12.6,0,15,17.7,29.2,129,4.4,8.599998,81.20001,7,Sri Lanka,Trincomalee,2010-04-30,4,2010,3.5
5/1/2010,51,30.8,25.7,28.2,37.0,29.9,33.5,5:49:00 AM,6:14:00 PM,19.69,0.5,0.5,0,3,16.1,27.7,321,4.17,8.599998,81.20001,7,Sri Lanka,Trincomalee,2010-05-01,5,2010,12.6
5/2/2010,55,31.0,26.3,28.4,38.5,31.0,34.1,5:49:00 AM,6:15:00 PM,22.46,2.9,2.9,0,4,14.2,24.1,112,4.73,8.599998,81.20001,7,Sri Lanka,Trincomalee,2010-05-02,5,2010,0.5
5/3/2010,61,31.1,26.4,27.8,38.5,31.4,33.4,5:48:00 AM,6:15:00 PM,19.11,4.8,4.8,0,6,12.2,23.4,205,4.05,8.599998,81.20001,7,Sri Lanka,Trincomalee,2010-05-03,5,2010,2.9
5/4/2010,61,32.7,26.4,28.8,39.3,31.3,34.2,5:48:00 AM,6:15:00 PM,22.8,3.2,3.2,0,3,14.4,23.0,233,4.9,8.599998,81.20001,7,Sri Lanka,Trincomalee,2010-05-04,5,2010,4.8
5/5/2010,61,32.7,27.0,28.8,39.4,31.2,34.1,5:48:00 AM,6:15:00 PM,23.05,3.0,3.0,0,4,15.5,25.9,233,5.02,8.599998,81.20001,7,Sri Lanka,Trincomalee,2010-05-05,5,2010,3.2
5/6/2010,3,33.3,26.9,29.6,41.5,31.2,34.9,5:47:00 AM,6:15:00 PM,23.55,0.0,0.0,0,0,18.0,28.8,191,5.42,8.599998,81.20001,7,Sri Lanka,Trincomalee,2010-05-06,5,2010,3.0
5/7/2010,51,32.2,26.9,29.1,40.2,32.1,35.0,5:47:00 AM,6:15:00 PM,23.93,0.9,0.9,0,4,12.2,24.5,227,5.2,8.599998,81.20001,7,Sri Lanka,Trincomalee,2010-05-07,5,2010,0.0
5/8/2010,63,32.4,26.1,28.1,40.9,31.0,34.0,5:47:00 AM,6:15:00 PM,23.09,11.0,11.0,0,6,11.6,23.0,211,4.86,8.599998,81.20001,7,Sri Lanka,Trincomalee,2010-05-08,5,2010,0.9
5/9/2010,63,32.3,26.2,28.3,39.3,30.9,33.6,5:47:00 AM,6:15:00 PM,22.58,12.5,12.5,0,6,15.5,28.8,218,4.9,8.599998,81.20001,7,Sri Lanka,Trincomalee,2010-05-09,5,2010,11.0
5/10/2010,2,32.8,26.8,29.5,40.3,31.3,34.9,5:46:00 AM,6:15:00 PM,19.98,0.0,0.0,0,0,14.4,27.4,208,4.72,8.599998,81.20001,7,Sri Lanka,Trincomalee,2010-05-10,5,2010,12.5
5/11/2010,51,32.7,27.3,29.9,41.6,31.9,35.8,5:46:00 AM,6:16:00 PM,24.87,0.4,0.4,0,1,13.0,23.8,193,5.59,8.599998,81.20001,7,Sri Lanka,Trincomalee,2010-05-11,5,2010,0.0
5/12/2010,53,33.2,27.5,29.7,41.6,32.5,35.6,5:46:00 AM,6:16:00 PM,24.53,1.5,1.5,0,4,13.0,25.6,192,5.49,8.599998,81.20001,7,Sri Lanka,Trincomalee,2010-05-12,5,2010,0.4
5/13/2010,51,33.8,27.3,30.2,41.3,32.1,36.0,5:46:00 AM,6:16:00 PM,24.44,0.6,0.6,0,3,16.9,29.2,215,5.49,8.599998,81.20001,7,Sri Lanka,Trincomalee,2010-05-13,5,2010,1.5
5/14/2010,1,33.4,27.3,30.0,40.1,31.0,34.7,5:46:00 AM,6:16:00 PM,22.47,0.0,0.0,0,0,19.0,29.9,220,5.54,8.599998,81.20001,7,Sri Lanka,Trincomalee,2010-05-14,5,2010,0.6
5/15/2010,51,34.2,27.3,30.0,41.2,30.7,34.8,5:46:00 AM,6:16:00 PM,22.73,1.2,1.2,0,8,21.3,34.6,219,5.43,8.599998,81.20001,7,Sri Lanka,Trincomalee,2010-05-15,5,2010,0.0
5/16/2010,51,33.2,27.1,29.7,40.0,30.1,33.9,5:45:00 AM,6:16:00 PM,21.27,0.2,0.2,0,2,23.2,34.9,235,5.45,8.599998,81.20001,7,Sri Lanka,Trincomalee,2010-05-16,5,2010,1.2
5/17/2010,61,33.7,27.1,28.9,38.2,29.9,32.8,5:45:00 AM,6:17:00 PM,16.11,4.5,4.5,0,5,25.6,42.8,236,4.32,8.599998,81.20001,7,Sri Lanka,Trincomalee,2010-05-17,5,2010,0.2
5/18/2010,3,31.6,27.1,28.6,32.8,28.7,30.1,5:45:00 AM,6:17:00 PM,13.75,0.0,0.0,0,0,39.0,58.3,238,4.52,8.599998,81.20001,7,Sri Lanka,Trincomalee,2010-05-18,5,2010,4.5
5/19/2010,51,32.1,27.1,29.1,34.3,29.3,31.2,5:45:00 AM,6:17:00 PM,19.9,0.1,0.1,0,1,36.5,59.4,230,5.56,8.599998,81.20001,7,Sri Lanka,Trincomalee,2010-05-19,5,2010,0.0
5/20/2010,3,31.9,27.0,28.7,33.2,29.5,30.9,5:45:00 AM,6:17:00 PM,18.23,0.0,0.0,0,0,35.8,56.5,228,4.96,8.599998,81.20001,7,Sri Lanka,Trincomalee,2010-05-20,5,2010,0.1
5/21/2010,51,31.2,26.8,28.4,34.1,29.2,31.2,5:45:00 AM,6:17:00 PM,14.33,0.7,0.7,0,5,28.1,45.7,229,4.2,8.599998,81.20001,7,Sri Lanka,Trincomalee,2010-05-21,5,2010,0.0
5/22/2010,51,32.6,26.8,29.2,35.1,29.1,31.6,5:45:00 AM,6:18:00 PM,17.02,0.2,0.2,0,1,29.6,47.2,233,5.11,8.599998,81.20001,7,Sri Lanka,Trincomalee,2010-05-22,5,2010,0.7
5/23/2010,3,33.0,27.0,29.2,36.4,29.0,31.6,5:45:00 AM,6:18:00 PM,19.69,0.0,0.0,0,0,27.9,47.5,232,5.59,8.599998,81.20001,7,Sri Lanka,Trincomalee,2010-05-23,5,2010,0.2
5/24/2010,3,33.1,27.0,29.4,35.2,28.7,31.1,5:45:00 AM,6:18:00 PM,19.56,0.0,0.0,0,0,32.2,51.5,236,5.89,8.599998,81.20001,7,Sri Lanka,Trincomalee,2010-05-24,5,2010,0.0
5/25/2010,3,33.4,27.2,29.5,35.0,29.1,31.1,5:45:00 AM,6:18:00 PM,21.22,0.0,0.0,0,0,35.3,58.3,240,6.26,8.599998,81.20001,7,Sri Lanka,Trincomalee,2010-05-25,5,2010,0.0
5/26/2010,2,34.4,27.3,30.1,36.9,28.8,32.0,5:45:00 AM,6:19:00 PM,24.41,0.0,0.0,0,0,33.0,52.9,243,6.93,8.599998,81.20001,7,Sri Lanka,Trincomalee,2010-05-26,5,2010,0.0
5/27/2010,1,33.8,27.2,30.1,36.3,28.7,32.0,5:45:00 AM,6:19:00 PM,23.11,0.0,0.0,0,0,35.8,54.7,243,6.81,8.599998,81.20001,7,Sri Lanka,Trincomalee,2010-05-27,5,2010,0.0
5/28/2010,51,34.1,27.1,29.8,37.3,29.3,32.0,5:45:00 AM,6:19:00 PM,21.59,0.3,0.3,0,1,34.7,52.9,241,6.28,8.599998,81.20001,7,Sri Lanka,Trincomalee,2010-05-28,5,2010,0.0
5/29/2010,2,35.1,26.9,30.2,38.2,28.9,32.4,5:45:00 AM,6:19:00 PM,23.36,0.0,0.0,0,0,30.1,51.1,242,6.82,8.599998,81.20001,7,Sri Lanka,Trincomalee,2010-05-29,5,2010,0.3
5/30/2010,51,35.5,26.8,30.1,39.0,28.9,32.6,5:45:00 AM,6:19:00 PM,25.25,0.2,0.2,0,1,32.6,50.4,241,6.99,8.599998,81.20001,7,Sri Lanka,Trincomalee,2010-05-30,5,2010,0.0
5/31/2010,51,35.5,26.9,30.3,39.1,28.9,33.0,5:45:00 AM,6:20:00 PM,23.64,0.1,0.1,0,1,28.0,43.9,242,6.7,8.599998,81.20001,7,Sri Lanka,Trincomalee,2010-05-31,5,2010,0.2
6/1/2010,1,36.1,27.2,31.0,42.8,30.0,35.2,5:45:00 AM,6:20:00 PM,24.88,0.0,0.0,0,0,23.0,36.7,217,6.49,8.599998,81.20001,7,Sri Lanka,Trincomalee,2010-06-01,6,2010,0.1
6/2/2010,1,36.0,27.3,30.9,41.3,30.3,34.6,5:45:00 AM,6:20:00 PM,24.6,0.0,0.0,0,0,23.2,37.1,240,6.61,8.599998,81.20001,7,Sri Lanka,Trincomalee,2010-06-02,6,2010,0.0
6/3/2010,1,35.7,27.4,31.1,40.5,30.3,34.7,5:45:00 AM,6:20:00 PM,23.91,0.0,0.0,0,0,22.0,36.0,238,6.52,8.599998,81.20001,7,Sri Lanka,Trincomalee,2010-06-03,6,2010,0.0
6/4/2010,51,36.4,27.2,30.6,41.2,29.3,33.4,5:45:00 AM,6:21:00 PM,24.22,0.1,0.1,0,1,30.8,47.2,240,6.91,8.599998,81.20001,7,Sri Lanka,Trincomalee,2010-06-04,6,2010,0.0
6/5/2010,51,35.7,26.5,29.7,39.2,28.2,31.9,5:45:00 AM,6:21:00 PM,23.95,0.8,0.8,0,3,31.4,47.2,244,6.77,8.599998,81.20001,7,Sri Lanka,Trincomalee,2010-06-05,6,2010,0.1
6/6/2010,55,34.3,26.6,29.2,36.9,28.3,31.1,5:45:00 AM,6:21:00 PM,20.76,1.5,1.5,0,2,30.6,56.2,245,6.14,8.599998,81.20001,7,Sri Lanka,Trincomalee,2010-06-06,6,2010,0.8
6/7/2010,51,33.3,27.1,29.3,35.2,28.8,31.3,5:45:00 AM,6:22:00 PM,19.13,0.4,0.4,0,3,29.7,45.7,247,5.81,8.599998,81.20001,7,Sri Lanka,Trincomalee,2010-06-07,6,2010,1.5
6/8/2010,53,33.4,27.1,29.1,36.0,28.5,31.1,5:45:00 AM,6:22:00 PM,14.1,1.2,1.2,0,2,29.8,47.5,241,4.95,8.599998,81.20001,7,Sri Lanka,Trincomalee,2010-06-08,6,2010,0.4
6/9/2010,51,33.6,27.0,29.4,34.6,28.6,30.7,5:46:00 AM,6:22:00 PM,16.95,0.6,0.6,0,3,31.5,51.8,243,5.93,8.599998,81.20001,7,Sri Lanka,Trincomalee,2010-06-09,6,2010,1.2
6/10/2010,51,33.9,26.6,28.9,35.1,27.7,30.1,5:46:00 AM,6:22:00 PM,16.06,0.2,0.2,0,1,35.4,55.8,243,5.57,8.599998,81.20001,7,Sri Lanka,Trincomalee,2010-06-10,6,2010,0.6
6/11/2010,3,32.1,27.0,28.8,32.5,28.4,29.9,5:46:00 AM,6:23:00 PM,15.97,0.0,0.0,0,0,37.8,63.4,244,5.33,8.599998,81.20001,7,Sri Lanka,Trincomalee,2010-06-11,6,2010,0.2
6/12/2010,2,32.6,26.4,28.9,33.3,28.2,30.2,5:46:00 AM,6:23:00 PM,16.72,0.0,0.0,0,0,37.2,59.0,237,5.48,8.599998,81.20001,7,Sri Lanka,Trincomalee,2010-06-12,6,2010,0.0
6/13/2010,51,31.3,26.5,28.3,32.7,28.5,30.3,5:46:00 AM,6:23:00 PM,18.16,0.3,0.3,0,3,31.3,51.8,235,5.06,8.599998,81.20001,7,Sri Lanka,Trincomalee,2010-06-13,6,2010,0.0
6/14/2010,55,34.1,26.5,29.3,36.8,28.8,31.9,5:46:00 AM,6:23:00 PM,21.13,1.1,1.1,0,2,25.0,40.3,235,5.87,8.599998,81.20001,7,Sri Lanka,Trincomalee,2010-06-14,6,2010,0.3
6/15/2010,51,35.2,26.8,30.3,39.5,29.2,33.7,5:46:00 AM,6:24:00 PM,22.19,0.2,0.2,0,2,20.9,32.8,227,6.03,8.599998,81.20001,7,Sri Lanka,Trincomalee,2010-06-15,6,2010,1.1
6/16/2010,51,34.7,27.0,30.2,39.8,29.9,34.0,5:47:00 AM,6:24:00 PM,21.28,0.1,0.1,0,1,18.0,31.7,232,5.48,8.599998,81.20001,7,Sri Lanka,Trincomalee,2010-06-16,6,2010,0.2
6/17/2010,51,35.0,26.8,29.8,38.6,28.9,32.4,5:47:00 AM,6:24:00 PM,19.72,0.2,0.2,0,1,24.1,35.6,231,5.89,8.599998,81.20001,7,Sri Lanka,Trincomalee,2010-06-17,6,2010,0.1
6/18/2010,3,33.8,26.7,29.5,37.6,29.2,32.3,5:47:00 AM,6:24:00 PM,17.07,0.0,0.0,0,0,24.5,41.0,231,5.18,8.599998,81.20001,7,Sri Lanka,Trincomalee,2010-06-18,6,2010,0.2
6/19/2010,51,34.5,26.9,29.9,38.8,29.4,33.0,5:47:00 AM,6:24:00 PM,21.61,0.4,0.4,0,2,19.1,34.6,223,5.94,8.599998,81.20001,7,Sri Lanka,Trincomalee,2010-06-19,6,2010,0.0
6/20/2010,63,34.5,26.9,29.1,40.4,29.9,33.3,5:47:00 AM,6:25:00 PM,21.78,7.5,7.5,0,3,16.3,31.3,218,5.35,8.599998,81.20001,7,Sri Lanka,Trincomalee,2010-06-20,6,2010,0.4
6/21/2010,61,34.0,26.8,29.2,38.6,29.2,32.4,5:48:00 AM,6:25:00 PM,22.36,3.0,3.0,0,2,22.9,35.6,234,5.82,8.599998,81.20001,7,Sri Lanka,Trincomalee,2010-06-21,6,2010,7.5
6/22/2010,3,33.5,26.6,29.3,36.1,28.3,31.5,5:48:00 AM,6:25:00 PM,23.18,0.0,0.0,0,0,28.2,47.2,236,6.45,8.599998,81.20001,7,Sri Lanka,Trincomalee,2010-06-22,6,2010,3.0
6/23/2010,2,32.6,26.4,28.7,34.1,27.3,29.9,5:48:00 AM,6:25:00 PM,19.81,0.0,0.0,0,0,34.0,57.2,239,5.87,8.599998,81.20001,7,Sri Lanka,Trincomalee,2010-06-23,6,2010,0.0
6/24/2010,2,34.3,27.0,29.7,35.4,27.8,30.8,5:48:00 AM,6:26:00 PM,20.25,0.0,0.0,0,0,30.3,50.0,248,6.88,8.599998,81.20001,7,Sri Lanka,Trincomalee,2010-06-24,6,2010,0.0
6/25/2010,2,35.0,27.1,30.1,37.5,28.8,32.0,5:49:00 AM,6:26:00 PM,20.59,0.0,0.0,0,0,26.7,41.8,251,6.59,8.599998,81.20001,7,Sri Lanka,Trincomalee,2010-06-25,6,2010,0.0
6/26/2010,2,35.2,27.3,30.0,38.1,29.0,31.9,5:49:00 AM,6:26:00 PM,18.88,0.0,0.0,0,0,26.3,46.4,248,6.21,8.599998,81.20001,7,Sri Lanka,Trincomalee,2010-06-26,6,2010,0.0
6/27/2010,1,35.6,26.8,30.2,38.6,29.1,32.3,5:49:00 AM,6:26:00 PM,22.95,0.0,0.0,0,0,25.6,43.2,242,6.93,8.599998,81.20001,7,Sri Lanka,Trincomalee,2010-06-27,6,2010,0.0
6/28/2010,51,33.7,26.4,29.3,35.6,28.7,30.9,5:49:00 AM,6:26:00 PM,19.6,0.1,0.1,0,1,31.2,50.4,240,6.09,8.599998,81.20001,7,Sri Lanka,Trincomalee,2010-06-28,6,2010,0.0
6/29/2010,2,34.3,26.4,29.5,37.1,27.6,31.1,5:49:00 AM,6:26:00 PM,19.88,0.0,0.0,0,0,30.9,50.4,239,6.32,8.599998,81.20001,7,Sri Lanka,Trincomalee,2010-06-29,6,2010,0.1
6/30/2010,2,33.3,26.4,29.2,33.7,27.2,29.4,5:50:00 AM,6:27:00 PM,21.61,0.0,0.0,0,0,39.0,65.2,241,6.98,8.599998,81.20001,7,Sri Lanka,Trincomalee,2010-06-30,6,2010,0.0
7/1/2010,51,32.5,26.0,28.4,33.1,27.5,29.3,5:50:00 AM,6:27:00 PM,19.88,0.1,0.1,0,1,34.9,58.0,239,5.93,8.599998,81.20001,7,Sri Lanka,Trincomalee,2010-07-01,7,2010,0.0
7/2/2010,3,32.3,26.2,28.7,33.0,27.6,30.0,5:50:00 AM,6:27:00 PM,18.18,0.0,0.0,0,0,30.3,53.6,240,5.74,8.599998,81.20001,7,Sri Lanka,Trincomalee,2010-07-02,7,2010,0.1
7/3/2010,51,34.0,26.2,29.4,35.4,27.8,30.9,5:50:00 AM,6:27:00 PM,22.72,0.1,0.1,0,1,28.2,53.6,239,6.74,8.599998,81.20001,7,Sri Lanka,Trincomalee,2010-07-03,7,2010,0.0
7/4/2010,51,33.7,26.3,29.3,36.0,27.9,31.2,5:51:00 AM,6:27:00 PM,19.35,0.1,0.1,0,1,31.6,48.6,243,6.01,8.599998,81.20001,7,Sri Lanka,Trincomalee,2010-07-04,7,2010,0.1
7/5/2010,53,33.6,26.3,29.0,35.3,28.9,31.3,5:51:00 AM,6:27:00 PM,16.13,0.7,0.7,0,2,25.4,47.5,245,5.16,8.599998,81.20001,7,Sri Lanka,Trincomalee,2010-07-05,7,2010,0.1
7/6/2010,55,31.8,26.3,28.6,35.0,29.1,32.2,5:51:00 AM,6:27:00 PM,14.62,2.4,2.4,0,3,19.7,32.0,255,3.89,8.599998,81.20001,7,Sri Lanka,Trincomalee,2010-07-06,7,2010,0.7
7/7/2010,53,32.0,26.1,28.5,37.4,29.8,32.7,5:51:00 AM,6:27:00 PM,22.44,0.7,0.7,0,2,18.1,28.8,148,5.11,8.599998,81.20001,7,Sri Lanka,Trincomalee,2010-07-07,7,2010,2.4
7/8/2010,51,31.8,25.9,28.3,37.5,30.4,33.0,5:52:00 AM,6:27:00 PM,22.38,0.9,0.9,0,3,15.2,29.2,130,4.91,8.599998,81.20001,7,Sri Lanka,Trincomalee,2010-07-08,7,2010,0.7
7/9/2010,53,31.5,25.9,28.0,37.6,30.3,32.5,5:52:00 AM,6:28:00 PM,22.19,1.9,1.9,0,6,19.5,32.4,128,4.89,8.599998,81.20001,7,Sri Lanka,Trincomalee,2010-07-09,7,2010,0.9
7/10/2010,51,31.9,26.3,28.6,36.8,30.4,33.0,5:52:00 AM,6:28:00 PM,23.98,0.4,0.4,0,2,20.9,35.3,140,5.35,8.599998,81.20001,7,Sri Lanka,Trincomalee,2010-07-10,7,2010,1.9
7/11/2010,53,31.9,26.1,28.8,38.1,29.4,33.3,5:52:00 AM,6:28:00 PM,21.67,1.0,1.0,0,2,13.7,25.6,192,5.06,8.599998,81.20001,7,Sri Lanka,Trincomalee,2010-07-11,7,2010,0.4
7/12/2010,2,34.3,26.3,29.4,39.0,27.9,32.2,5:53:00 AM,6:28:00 PM,23.72,0.0,0.0,0,0,25.0,38.2,236,6.27,8.599998,81.20001,7,Sri Lanka,Trincomalee,2010-07-12,7,2010,1.0
7/13/2010,51,34.0,26.0,29.1,36.4,27.4,30.9,5:53:00 AM,6:28:00 PM,22.25,0.1,0.1,0,1,28.2,44.6,243,6.48,8.599998,81.20001,7,Sri Lanka,Trincomalee,2010-07-13,7,2010,0.0
7/14/2010,51,33.3,26.0,28.7,35.6,27.6,30.4,5:53:00 AM,6:28:00 PM,21.37,0.2,0.2,0,1,28.5,46.1,247,6.15,8.599998,81.20001,7,Sri Lanka,Trincomalee,2010-07-14,7,2010,0.1
7/15/2010,1,33.6,26.2,29.2,35.4,27.5,30.5,5:53:00 AM,6:28:00 PM,23.54,0.0,0.0,0,0,30.4,55.4,245,6.82,8.599998,81.20001,7,Sri Lanka,Trincomalee,2010-07-15,7,2010,0.2
7/16/2010,51,33.2,26.1,28.8,34.6,27.3,29.8,5:53:00 AM,6:28:00 PM,21.15,0.1,0.1,0,1,38.4,59.4,244,6.37,8.599998,81.20001,7,Sri Lanka,Trincomalee,2010-07-16,7,2010,0.0
7/17/2010,51,32.9,26.7,28.5,34.4,28.2,30.0,5:54:00 AM,6:28:00 PM,17.52,0.3,0.3,0,2,29.9,51.1,240,5.53,8.599998,81.20001,7,Sri Lanka,Trincomalee,2010-07-17,7,2010,0.1
7/18/2010,3,32.8,26.6,29.1,33.6,28.3,30.5,5:54:00 AM,6:28:00 PM,17.17,0.0,0.0,0,0,31.6,50.0,247,5.68,8.599998,81.20001,7,Sri Lanka,Trincomalee,2010-07-18,7,2010,0.3
7/19/2010,51,31.0,26.6,28.4,32.1,27.7,29.7,5:54:00 AM,6:28:00 PM,12.3,0.5,0.5,0,3,30.9,48.2,248,4.66,8.599998,81.20001,7,Sri Lanka,Trincomalee,2010-07-19,7,2010,0.0
7/20/2010,3,30.6,26.6,28.2,31.7,28.2,29.8,5:54:00 AM,6:28:00 PM,10.62,0.0,0.0,0,0,27.5,48.6,246,4.26,8.599998,81.20001,7,Sri Lanka,Trincomalee,2010-07-20,7,2010,0.5
7/21/2010,3,33.1,26.5,29.3,35.3,28.6,31.1,5:54:00 AM,6:27:00 PM,17.15,0.0,0.0,0,0,25.6,41.0,246,5.63,8.599998,81.20001,7,Sri Lanka,Trincomalee,2010-07-21,7,2010,0.0
7/22/2010,63,34.8,26.4,29.1,40.7,28.8,33.2,5:55:00 AM,6:27:00 PM,22.42,5.6,5.6,0,3,22.3,38.2,238,5.37,8.599998,81.20001,7,Sri Lanka,Trincomalee,2010-07-22,7,2010,0.0
7/23/2010,63,33.6,26.3,28.7,39.9,28.3,32.5,5:55:00 AM,6:27:00 PM,20.73,5.8,5.8,0,3,23.8,37.4,227,5.12,8.599998,81.20001,7,Sri Lanka,Trincomalee,2010-07-23,7,2010,5.6
7/24/2010,1,33.9,26.3,29.5,37.6,28.1,31.7,5:55:00 AM,6:27:00 PM,22.26,0.0,0.0,0,0,28.0,43.2,244,6.29,8.599998,81.20001,7,Sri Lanka,Trincomalee,2010-07-24,7,2010,5.8
7/25/2010,3,33.9,26.7,29.4,34.9,28.3,30.8,5:55:00 AM,6:27:00 PM,20.2,0.0,0.0,0,0,29.4,46.8,248,6.43,8.599998,81.20001,7,Sri Lanka,Trincomalee,2010-07-25,7,2010,0.0
7/26/2010,1,34.6,26.7,29.9,36.7,28.8,31.9,5:55:00 AM,6:27:00 PM,23.62,0.0,0.0,0,0,25.4,42.5,248,6.95,8.599998,81.20001,7,Sri Lanka,Trincomalee,2010-07-26,7,2010,0.0
7/27/2010,51,34.0,26.6,29.5,37.0,28.1,31.5,5:55:00 AM,6:27:00 PM,21.44,0.1,0.1,0,1,28.9,49.0,250,6.35,8.599998,81.20001,7,Sri Lanka,Trincomalee,2010-07-27,7,2010,0.0
7/28/2010,51,34.4,26.6,29.5,37.3,28.1,31.6,5:56:00 AM,6:27:00 PM,19.75,0.2,0.2,0,1,28.8,47.5,250,6.02,8.599998,81.20001,7,Sri Lanka,Trincomalee,2010-07-28,7,2010,0.1
7/29/2010,3,32.8,26.6,29.2,35.0,27.8,30.8,5:56:00 AM,6:26:00 PM,17.17,0.0,0.0,0,0,29.8,47.9,250,5.69,8.599998,81.20001,7,Sri Lanka,Trincomalee,2010-07-29,7,2010,0.2
7/30/2010,51,33.1,26.5,28.8,35.3,27.5,30.6,5:56:00 AM,6:26:00 PM,16.82,0.1,0.1,0,1,28.1,42.5,244,5.48,8.599998,81.20001,7,Sri Lanka,Trincomalee,2010-07-30,7,2010,0.0
7/31/2010,2,34.5,26.4,29.9,37.4,27.7,31.7,5:56:00 AM,6:26:00 PM,23.02,0.0,0.0,0,0,26.3,43.2,248,6.89,8.599998,81.20001,7,Sri Lanka,Trincomalee,2010-07-31,7,2010,0.1
8/1/2010,53,34.9,26.7,30.0,40.4,28.5,33.4,5:56:00 AM,6:26:00 PM,22.55,0.5,0.5,0,1,23.0,38.2,246,5.95,8.599998,81.20001,7,Sri Lanka,Trincomalee,2010-08-01,8,2010,0.0
8/2/2010,51,33.9,26.7,29.6,38.0,28.0,32.0,5:56:00 AM,6:25:00 PM,17.9,0.3,0.3,0,2,27.2,41.4,238,5.52,8.599998,81.20001,7,Sri Lanka,Trincomalee,2010-08-02,8,2010,0.5
8/3/2010,51,33.1,26.8,29.1,34.7,28.2,30.5,5:56:00 AM,6:25:00 PM,17.56,0.1,0.1,0,1,28.4,45.4,245,5.81,8.599998,81.20001,7,Sri Lanka,Trincomalee,2010-08-03,8,2010,0.3
8/4/2010,2,33.1,26.7,29.3,34.2,28.2,30.5,5:56:00 AM,6:25:00 PM,17.5,0.0,0.0,0,0,27.7,46.8,244,6.0,8.599998,81.20001,7,Sri Lanka,Trincomalee,2010-08-04,8,2010,0.1
8/5/2010,1,35.2,26.6,29.9,39.1,28.1,32.2,5:56:00 AM,6:25:00 PM,22.8,0.0,0.0,0,0,26.6,43.6,242,6.62,8.599998,81.20001,7,Sri Lanka,Trincomalee,2010-08-05,8,2010,0.0
8/6/2010,1,35.0,26.7,29.9,37.5,28.0,31.5,5:57:00 AM,6:24:00 PM,24.19,0.0,0.0,0,0,27.9,46.8,235,7.23,8.599998,81.20001,7,Sri Lanka,Trincomalee,2010-08-06,8,2010,0.0
8/7/2010,2,34.9,26.6,29.9,37.3,27.9,31.5,5:57:00 AM,6:24:00 PM,23.19,0.0,0.0,0,0,27.7,45.7,240,7.18,8.599998,81.20001,7,Sri Lanka,Trincomalee,2010-08-07,8,2010,0.0
8/8/2010,51,35.1,26.5,29.7,37.9,28.2,31.7,5:57:00 AM,6:24:00 PM,23.55,0.2,0.2,0,2,27.7,52.2,243,6.85,8.599998,81.20001,7,Sri Lanka,Trincomalee,2010-08-08,8,2010,0.0
8/9/2010,63,34.5,26.1,28.8,38.6,28.3,31.4,5:57:00 AM,6:23:00 PM,19.35,5.2,5.2,0,2,26.6,43.6,246,5.37,8.599998,81.20001,7,Sri Lanka,Trincomalee,2010-08-09,8,2010,0.2
8/10/2010,61,34.0,26.1,29.0,40.5,28.2,33.6,5:57:00 AM,6:23:00 PM,22.43,3.9,3.9,0,4,21.6,36.7,258,5.16,8.599998,81.20001,7,Sri Lanka,Trincomalee,2010-08-10,8,2010,5.2
8/11/2010,61,33.7,26.5,28.9,38.8,28.9,32.8,5:57:00 AM,6:23:00 PM,20.92,3.2,3.2,0,3,22.0,34.6,242,5.21,8.599998,81.20001,7,Sri Lanka,Trincomalee,2010-08-11,8,2010,3.9
8/12/2010,53,33.8,26.3,29.1,39.6,28.0,32.3,5:57:00 AM,6:22:00 PM,22.97,0.8,0.8,0,3,24.8,39.6,230,5.88,8.599998,81.20001,7,Sri Lanka,Trincomalee,2010-08-12,8,2010,3.2
8/13/2010,51,32.7,26.0,28.6,36.4,28.0,31.5,5:57:00 AM,6:22:00 PM,19.35,0.6,0.6,0,2,23.7,46.1,229,5.13,8.599998,81.20001,7,Sri Lanka,Trincomalee,2010-08-13,8,2010,0.8
8/14/2010,65,33.4,26.0,28.1,39.3,28.5,32.3,5:57:00 AM,6:22:00 PM,19.89,17.5,17.5,0,8,24.2,45.0,230,4.72,8.599998,81.20001,7,Sri Lanka,Trincomalee,2010-08-14,8,2010,0.6
8/15/2010,51,31.2,25.9,27.7,32.4,26.7,28.6,5:57:00 AM,6:21:00 PM,16.59,0.2,0.2,0,1,35.2,49.7,240,5.1,8.599998,81.20001,7,Sri Lanka,Trincomalee,2010-08-15,8,2010,17.5
8/16/2010,3,31.1,26.0,27.9,32.0,27.1,29.2,5:57:00 AM,6:21:00 PM,15.07,0.0,0.0,0,0,30.2,51.8,242,4.89,8.599998,81.20001,7,Sri Lanka,Trincomalee,2010-08-16,8,2010,0.2
8/17/2010,51,31.8,26.2,28.4,34.4,27.5,30.2,5:57:00 AM,6:20:00 PM,20.35,0.7,0.7,0,3,27.2,51.5,251,5.76,8.599998,81.20001,7,Sri Lanka,Trincomalee,2010-08-17,8,2010,0.0
8/18/2010,63,32.1,26.0,28.1,36.1,27.8,31.3,5:57:00 AM,6:20:00 PM,21.29,4.5,4.5,0,3,24.2,40.3,255,5.32,8.599998,81.20001,7,Sri Lanka,Trincomalee,2010-08-18,8,2010,0.7
8/19/2010,63,31.4,25.1,27.6,36.6,28.1,31.9,5:57:00 AM,6:20:00 PM,17.37,15.1,15.1,0,11,20.1,32.4,255,4.02,8.599998,81.20001,7,Sri Lanka,Trincomalee,2010-08-19,8,2010,4.5
8/20/2010,61,29.7,24.4,26.3,33.8,27.4,30.6,5:57:00 AM,6:19:00 PM,11.16,15.7,15.7,0,16,20.5,31.7,260,2.55,8.599998,81.20001,7,Sri Lanka,Trincomalee,2010-08-20,8,2010,15.1
8/21/2010,63,25.9,24.4,25.1,28.8,26.8,27.8,5:57:00 AM,6:19:00 PM,3.71,29.7,29.7,0,13,24.6,37.1,255,1.22,8.599998,81.20001,7,Sri Lanka,Trincomalee,2010-08-21,8,2010,15.7
8/22/2010,51,30.9,24.9,27.4,35.1,26.8,29.7,5:57:00 AM,6:18:00 PM,20.63,0.6,0.6,0,2,28.1,46.8,252,5.04,8.599998,81.20001,7,Sri Lanka,Trincomalee,2010-08-22,8,2010,29.7
8/23/2010,53,30.2,25.4,27.4,33.5,27.4,30.0,5:57:00 AM,6:18:00 PM,14.65,1.6,1.6,0,2,27.8,44.3,251,3.95,8.599998,81.20001,7,Sri Lanka,Trincomalee,2010-08-23,8,2010,0.6
8/24/2010,61,29.8,25.8,27.0,32.9,27.3,29.6,5:57:00 AM,6:17:00 PM,11.06,3.9,3.9,0,10,27.3,46.1,249,3.18,8.599998,81.20001,7,Sri Lanka,Trincomalee,2010-08-24,8,2010,1.6
8/25/2010,51,31.4,25.9,28.0,34.9,26.7,29.7,5:57:00 AM,6:17:00 PM,21.84,0.1,0.1,0,1,28.8,53.6,244,5.85,8.599998,81.20001,7,Sri Lanka,Trincomalee,2010-08-25,8,2010,3.9
8/26/2010,3,30.9,25.8,27.8,32.3,26.7,29.0,5:57:00 AM,6:16:00 PM,17.95,0.0,0.0,0,0,33.9,53.6,243,5.22,8.599998,81.20001,7,Sri Lanka,Trincomalee,2010-08-26,8,2010,0.1
8/27/2010,2,31.6,25.6,28.1,35.2,27.5,30.3,5:57:00 AM,6:16:00 PM,18.45,0.0,0.0,0,0,24.3,38.9,238,5.15,8.599998,81.20001,7,Sri Lanka,Trincomalee,2010-08-27,8,2010,0.0
8/28/2010,3,31.7,25.7,28.3,34.1,27.5,30.2,5:57:00 AM,6:15:00 PM,19.39,0.0,0.0,0,0,26.1,44.6,234,5.42,8.599998,81.20001,7,Sri Lanka,Trincomalee,2010-08-28,8,2010,0.0
8/29/2010,51,29.8,25.8,27.3,32.2,26.9,28.9,5:56:00 AM,6:15:00 PM,13.0,0.8,0.8,0,4,30.4,51.5,237,4.02,8.599998,81.20001,7,Sri Lanka,Trincomalee,2010-08-29,8,2010,0.0
8/30/2010,3,30.0,25.4,27.2,30.7,25.8,27.9,5:56:00 AM,6:14:00 PM,17.51,0.0,0.0,0,0,36.4,56.2,241,5.15,8.599998,81.20001,7,Sri Lanka,Trincomalee,2010-08-30,8,2010,0.8
8/31/2010,3,32.5,25.5,28.3,36.7,26.6,30.8,5:56:00 AM,6:14:00 PM,22.75,0.0,0.0,0,0,25.1,39.2,247,5.88,8.599998,81.20001,7,Sri Lanka,Trincomalee,2010-08-31,8,2010,0.0
9/1/2010,51,33.0,25.4,28.6,37.8,26.7,31.8,5:56:00 AM,6:13:00 PM,24.81,0.2,0.2,0,1,24.6,39.6,251,5.98,8.599998,81.20001,7,Sri Lanka,Trincomalee,2010-09-01,9,2010,0.0
9/2/2010,53,33.0,25.5,28.7,38.3,27.5,32.4,5:56:00 AM,6:13:00 PM,23.71,0.7,0.7,0,2,21.5,36.7,242,5.66,8.599998,81.20001,7,Sri Lanka,Trincomalee,2010-09-02,9,2010,0.2
9/3/2010,53,33.7,25.7,28.2,40.3,27.3,32.2,5:56:00 AM,6:12:00 PM,21.58,1.4,1.4,0,4,25.0,41.0,240,5.1,8.599998,81.20001,7,Sri Lanka,Trincomalee,2010-09-03,9,2010,0.7
9/4/2010,1,32.8,25.7,28.6,35.9,27.2,30.5,5:56:00 AM,6:11:00 PM,23.72,0.0,0.0,0,0,27.2,45.7,237,6.42,8.599998,81.20001,7,Sri Lanka,Trincomalee,2010-09-04,9,2010,1.4
9/5/2010,2,32.9,25.8,28.8,35.2,26.9,30.2,5:56:00 AM,6:11:00 PM,24.07,0.0,0.0,0,0,26.1,43.9,242,6.8,8.599998,81.20001,7,Sri Lanka,Trincomalee,2010-09-05,9,2010,0.0
9/6/2010,1,33.1,25.7,28.8,36.4,26.8,30.6,5:56:00 AM,6:10:00 PM,24.74,0.0,0.0,0,0,26.3,42.1,243,6.69,8.599998,81.20001,7,Sri Lanka,Trincomalee,2010-09-06,9,2010,0.0
9/7/2010,2,33.6,25.7,29.1,36.5,27.2,30.8,5:56:00 AM,6:10:00 PM,24.86,0.0,0.0,0,0,29.4,43.6,243,6.92,8.599998,81.20001,7,Sri Lanka,Trincomalee,2010-09-07,9,2010,0.0
9/8/2010,51,33.8,26.3,29.3,36.7,27.6,31.2,5:56:00 AM,6:09:00 PM,22.83,0.1,0.1,0,1,27.5,42.1,242,6.51,8.599998,81.20001,7,Sri Lanka,Trincomalee,2010-09-08,9,2010,0.0
9/9/2010,51,33.9,26.4,29.1,37.6,28.4,31.5,5:55:00 AM,6:09:00 PM,20.51,0.3,0.3,0,1,25.1,38.5,242,5.89,8.599998,81.20001,7,Sri Lanka,Trincomalee,2010-09-09,9,2010,0.1
9/10/2010,51,32.8,26.1,28.5,36.6,28.8,31.3,5:55:00 AM,6:08:00 PM,17.5,0.9,0.9,0,4,23.5,37.8,234,4.9,8.599998,81.20001,7,Sri Lanka,Trincomalee,2010-09-10,9,2010,0.3
9/11/2010,63,31.4,25.7,27.0,35.1,28.8,31.4,5:55:00 AM,6:07:00 PM,16.79,16.0,16.0,0,7,18.4,34.9,258,3.65,8.599998,81.20001,7,Sri Lanka,Trincomalee,2010-09-11,9,2010,0.9
9/12/2010,63,30.3,25.6,27.3,36.2,28.4,31.6,5:55:00 AM,6:07:00 PM,18.32,5.2,5.2,0,3,19.8,33.1,234,4.11,8.599998,81.20001,7,Sri Lanka,Trincomalee,2010-09-12,9,2010,16.0
9/13/2010,51,32.2,25.7,28.2,36.3,27.8,30.6,5:55:00 AM,6:06:00 PM,20.22,0.1,0.1,0,1,25.4,39.2,245,5.44,8.599998,81.20001,7,Sri Lanka,Trincomalee,2010-09-13,9,2010,5.2
9/14/2010,51,30.1,25.7,27.4,32.2,27.5,29.6,5:55:00 AM,6:06:00 PM,11.01,1.2,1.2,0,4,24.4,38.9,244,3.64,8.599998,81.20001,7,Sri Lanka,Trincomalee,2010-09-14,9,2010,0.1
9/15/2010,51,32.2,25.6,28.3,34.9,27.3,30.0,5:55:00 AM,6:05:00 PM,22.69,0.1,0.1,0,1,29.5,50.8,241,6.07,8.599998,81.20001,7,Sri Lanka,Trincomalee,2010-09-15,9,2010,1.2
9/16/2010,51,33.4,25.9,28.7,36.6,27.4,30.8,5:55:00 AM,6:04:00 PM,22.99,0.1,0.1,0,1,26.1,46.8,245,6.28,8.599998,81.20001,7,Sri Lanka,Trincomalee,2010-09-16,9,2010,0.1
9/17/2010,1,33.9,26.2,29.3,37.3,28.0,31.4,5:54:00 AM,6:04:00 PM,24.46,0.0,0.0,0,0,27.7,46.4,246,6.71,8.599998,81.20001,7,Sri Lanka,Trincomalee,2010-09-17,9,2010,0.1
9/18/2010,2,33.0,26.2,28.6,36.2,27.9,30.8,5:54:00 AM,6:03:00 PM,21.28,0.0,0.0,0,0,28.5,50.8,243,5.83,8.599998,81.20001,7,Sri Lanka,Trincomalee,2010-09-18,9,2010,0.0
9/19/2010,51,32.4,25.9,28.5,36.7,28.5,31.7,5:54:00 AM,6:03:00 PM,22.06,0.6,0.6,0,3,24.5,42.8,249,5.51,8.599998,81.20001,7,Sri Lanka,Trincomalee,2010-09-19,9,2010,0.0
9/20/2010,63,32.3,25.0,27.5,39.4,28.4,31.8,5:54:00 AM,6:02:00 PM,21.96,19.1,19.1,0,7,19.8,35.3,216,4.82,8.599998,81.20001,7,Sri Lanka,Trincomalee,2010-09-20,9,2010,0.6
9/21/2010,61,30.6,25.1,26.6,37.1,28.9,31.5,5:54:00 AM,6:02:00 PM,17.95,7.8,7.8,0,8,13.7,22.3,247,3.78,8.599998,81.20001,7,Sri Lanka,Trincomalee,2010-09-21,9,2010,19.1
9/22/2010,63,30.3,24.6,26.7,36.8,28.7,31.6,5:54:00 AM,6:01:00 PM,20.17,18.0,18.0,0,11,18.7,32.8,256,4.1,8.599998,81.20001,7,Sri Lanka,Trincomalee,2010-09-22,9,2010,7.8
9/23/2010,61,31.3,25.4,27.2,37.6,27.7,31.3,5:54:00 AM,6:00:00 PM,20.96,2.4,2.4,0,3,21.4,32.0,247,4.59,8.599998,81.20001,7,Sri Lanka,Trincomalee,2010-09-23,9,2010,18.0
9/24/2010,51,30.2,25.4,27.2,32.3,27.4,29.2,5:54:00 AM,6:00:00 PM,18.68,0.4,0.4,0,2,29.5,47.9,245,4.72,8.599998,81.20001,7,Sri Lanka,Trincomalee,2010-09-24,9,2010,2.4
9/25/2010,61,31.9,25.5,27.7,36.8,27.8,31.5,5:54:00 AM,5:59:00 PM,21.34,2.9,2.9,0,3,19.9,35.6,244,4.87,8.599998,81.20001,7,Sri Lanka,Trincomalee,2010-09-25,9,2010,0.4
9/26/2010,51,29.5,25.4,26.8,34.1,29.3,31.4,5:53:00 AM,5:59:00 PM,13.45,2.1,2.1,0,10,12.2,20.5,180,2.99,8.599998,81.20001,7,Sri Lanka,Trincomalee,2010-09-26,9,2010,2.9
9/27/2010,61,28.9,25.1,27.1,34.1,29.9,31.9,5:53:00 AM,5:58:00 PM,19.45,3.4,3.4,0,7,14.7,25.6,131,3.96,8.599998,81.20001,7,Sri Lanka,Trincomalee,2010-09-27,9,2010,2.1
9/28/2010,63,30.0,24.1,26.1,36.4,28.4,30.9,5:53:00 AM,5:58:00 PM,18.75,22.6,22.6,0,17,15.0,25.6,297,3.79,8.599998,81.20001,7,Sri Lanka,Trincomalee,2010-09-28,9,2010,3.4
9/29/2010,63,29.2,24.2,25.9,34.7,27.1,30.1,5:53:00 AM,5:57:00 PM,15.7,11.3,11.3,0,13,14.2,22.7,264,3.2,8.599998,81.20001,7,Sri Lanka,Trincomalee,2010-09-29,9,2010,22.6
9/30/2010,53,27.5,24.1,25.4,33.1,27.1,30.2,5:53:00 AM,5:56:00 PM,8.29,5.8,5.8,0,16,13.3,22.3,266,1.81,8.599998,81.20001,7,Sri Lanka,Trincomalee,2010-09-30,9,2010,11.3
10/1/2010,61,28.9,24.4,26.2,35.6,29.2,31.4,5:53:00 AM,5:56:00 PM,19.89,7.3,7.3,0,13,13.3,27.0,84,3.93,8.599998,81.20001,7,Sri Lanka,Trincomalee,2010-10-01,10,2010,5.8
10/2/2010,63,29.1,24.9,26.1,36.0,28.1,30.7,5:53:00 AM,5:55:00 PM,17.17,9.9,9.9,0,13,17.4,28.8,255,3.51,8.599998,81.20001,7,Sri Lanka,Trincomalee,2010-10-02,10,2010,7.3
10/3/2010,61,30.3,24.9,26.7,35.0,27.6,30.0,5:53:00 AM,5:55:00 PM,19.47,3.7,3.7,0,2,22.3,36.4,263,4.29,8.599998,81.20001,7,Sri Lanka,Trincomalee,2010-10-03,10,2010,9.9
10/4/2010,53,31.0,25.5,27.7,35.3,27.6,31.1,5:53:00 AM,5:54:00 PM,20.52,1.1,1.1,0,3,24.3,42.1,272,4.75,8.599998,81.20001,7,Sri Lanka,Trincomalee,2010-10-04,10,2010,3.7
10/5/2010,51,31.1,26.0,27.8,35.5,27.6,30.2,5:53:00 AM,5:54:00 PM,21.1,0.4,0.4,0,1,29.8,47.2,253,5.21,8.599998,81.20001,7,Sri Lanka,Trincomalee,2010-10-05,10,2010,1.1
10/6/2010,51,30.2,26.2,27.6,32.1,27.6,29.0,5:52:00 AM,5:53:00 PM,19.3,0.2,0.2,0,1,37.9,57.2,246,5.0,8.599998,81.20001,7,Sri Lanka,Trincomalee,2010-10-06,10,2010,0.4
10/7/2010,3,30.4,25.9,27.6,32.4,27.4,29.1,5:52:00 AM,5:53:00 PM,18.64,0.0,0.0,0,0,34.9,53.3,238,4.94,8.599998,81.20001,7,Sri Lanka,Trincomalee,2010-10-07,10,2010,0.2
10/8/2010,2,30.6,25.7,27.7,33.1,27.4,29.7,5:52:00 AM,5:52:00 PM,19.3,0.0,0.0,0,0,30.2,51.1,231,5.01,8.599998,81.20001,7,Sri Lanka,Trincomalee,2010-10-08,10,2010,0.0
10/9/2010,51,30.8,25.9,27.8,33.9,27.6,30.0,5:52:00 AM,5:51:00 PM,18.61,0.2,0.2,0,1,33.8,52.9,237,4.86,8.599998,81.20001,7,Sri Lanka,Trincomalee,2010-10-09,10,2010,0.0
10/10/2010,2,30.9,26.0,27.8,33.6,27.9,30.2,5:52:00 AM,5:51:00 PM,15.31,0.0,0.0,0,0,25.2,39.6,240,4.39,8.599998,81.20001,7,Sri Lanka,Trincomalee,2010-10-10,10,2010,0.2
10/11/2010,1,32.3,25.9,28.4,34.3,27.8,30.2,5:52:00 AM,5:51:00 PM,22.87,0.0,0.0,0,0,26.8,41.8,245,6.11,8.599998,81.20001,7,Sri Lanka,Trincomalee,2010-10-11,10,2010,0.0
10/12/2010,51,32.0,25.8,28.1,35.2,27.2,30.3,5:52:00 AM,5:50:00 PM,20.27,0.2,0.2,0,1,26.8,41.0,249,5.4,8.599998,81.20001,7,Sri Lanka,Trincomalee,2010-10-12,10,2010,0.0
10/13/2010,2,32.3,25.5,28.3,35.7,26.6,30.3,5:52:00 AM,5:50:00 PM,23.79,0.0,0.0,0,0,28.0,43.6,253,6.2,8.599998,81.20001,7,Sri Lanka,Trincomalee,2010-10-13,10,2010,0.2
10/14/2010,2,32.0,25.5,28.3,35.0,26.7,30.2,5:52:00 AM,5:49:00 PM,22.45,0.0,0.0,0,0,28.4,43.9,251,5.98,8.599998,81.20001,7,Sri Lanka,Trincomalee,2010-10-14,10,2010,0.0
10/15/2010,1,32.3,26.1,28.5,34.0,27.6,29.8,5:52:00 AM,5:49:00 PM,21.25,0.0,0.0,0,0,28.7,45.7,249,6.15,8.599998,81.20001,7,Sri Lanka,Trincomalee,2010-10-15,10,2010,0.0
10/16/2010,51,32.5,25.9,28.5,35.7,27.4,30.4,5:52:00 AM,5:48:00 PM,22.62,0.1,0.1,0,1,27.1,45.0,244,6.17,8.599998,81.20001,7,Sri Lanka,Trincomalee,2010-10-16,10,2010,0.0
10/17/2010,1,32.5,25.5,28.4,35.6,27.1,30.4,5:52:00 AM,5:48:00 PM,21.76,0.0,0.0,0,0,24.7,44.6,235,5.95,8.599998,81.20001,7,Sri Lanka,Trincomalee,2010-10-17,10,2010,0.1
10/18/2010,51,32.0,25.4,28.1,35.4,27.0,30.7,5:52:00 AM,5:47:00 PM,19.57,0.3,0.3,0,2,26.4,45.7,234,5.15,8.599998,81.20001,7,Sri Lanka,Trincomalee,2010-10-18,10,2010,0.0
10/19/2010,51,32.5,25.7,28.3,37.8,28.5,32.2,5:52:00 AM,5:47:00 PM,21.77,0.6,0.6,0,3,17.6,30.6,232,5.01,8.599998,81.20001,7,Sri Lanka,Trincomalee,2010-10-19,10,2010,0.3
10/20/2010,53,32.9,25.5,28.3,38.3,28.8,32.4,5:52:00 AM,5:47:00 PM,22.32,1.5,1.5,0,5,17.5,32.8,235,5.05,8.599998,81.20001,7,Sri Lanka,Trincomalee,2010-10-20,10,2010,0.6
10/21/2010,51,32.3,25.3,28.1,36.7,27.5,30.9,5:52:00 AM,5:46:00 PM,21.39,0.3,0.3,0,2,22.2,34.6,240,5.5,8.599998,81.20001,7,Sri Lanka,Trincomalee,2010-10-21,10,2010,1.5
10/22/2010,51,32.7,25.4,28.3,35.1,26.3,29.8,5:52:00 AM,5:46:00 PM,23.17,0.1,0.1,0,1,26.4,42.8,240,6.38,8.599998,81.20001,7,Sri Lanka,Trincomalee,2010-10-22,10,2010,0.3
10/23/2010,1,33.5,25.3,28.7,36.4,26.8,30.4,5:52:00 AM,5:45:00 PM,23.3,0.0,0.0,0,0,26.9,44.3,246,6.45,8.599998,81.20001,7,Sri Lanka,Trincomalee,2010-10-23,10,2010,0.1
10/24/2010,2,33.0,25.4,28.9,37.2,27.3,31.9,5:53:00 AM,5:45:00 PM,22.05,0.0,0.0,0,0,22.7,39.6,242,5.66,8.599998,81.20001,7,Sri Lanka,Trincomalee,2010-10-24,10,2010,0.0
10/25/2010,51,33.1,25.8,29.0,39.4,28.7,33.1,5:53:00 AM,5:45:00 PM,22.29,0.5,0.5,0,2,18.1,33.8,213,5.25,8.599998,81.20001,7,Sri Lanka,Trincomalee,2010-10-25,10,2010,0.0
10/26/2010,53,33.4,25.7,28.7,39.6,29.0,33.1,5:53:00 AM,5:44:00 PM,23.28,1.9,1.9,0,7,15.8,28.4,171,5.27,8.599998,81.20001,7,Sri Lanka,Trincomalee,2010-10-26,10,2010,0.5
10/27/2010,61,30.7,25.1,27.3,35.6,30.3,32.1,5:53:00 AM,5:44:00 PM,16.41,4.9,4.9,0,7,10.2,22.3,168,3.58,8.599998,81.20001,7,Sri Lanka,Trincomalee,2010-10-27,10,2010,1.9
10/28/2010,61,27.6,24.4,25.4,32.8,28.5,30.3,5:53:00 AM,5:44:00 PM,8.81,14.6,14.6,0,22,10.9,20.5,193,1.9,8.599998,81.20001,7,Sri Lanka,Trincomalee,2010-10-28,10,2010,4.9
10/29/2010,61,28.4,24.1,25.6,33.9,28.1,30.1,5:53:00 AM,5:44:00 PM,16.77,11.0,11.0,0,17,14.5,25.9,335,3.3,8.599998,81.20001,7,Sri Lanka,Trincomalee,2010-10-29,10,2010,14.6
10/30/2010,63,28.6,24.2,26.0,33.7,28.2,30.6,5:53:00 AM,5:43:00 PM,14.02,9.6,9.6,0,9,11.2,25.2,203,2.93,8.599998,81.20001,7,Sri Lanka,Trincomalee,2010-10-30,10,2010,11.0
10/31/2010,61,29.4,24.9,26.6,35.0,28.7,30.8,5:53:00 AM,5:43:00 PM,17.91,3.7,3.7,0,5,16.5,32.0,246,3.8,8.599998,81.20001,7,Sri Lanka,Trincomalee,2010-10-31,10,2010,9.6
11/1/2010,61,30.6,24.9,27.1,35.8,27.9,30.8,5:54:00 AM,5:43:00 PM,19.49,2.7,2.7,0,3,18.0,29.5,237,4.44,8.599998,81.20001,7,Sri Lanka,Trincomalee,2010-11-01,11,2010,3.7
11/2/2010,3,31.2,25.0,27.7,35.5,28.1,31.8,5:54:00 AM,5:43:00 PM,17.87,0.0,0.0,0,0,16.5,28.8,236,3.94,8.599998,81.20001,7,Sri Lanka,Trincomalee,2010-11-02,11,2010,2.7
11/3/2010,51,31.0,24.9,27.3,37.9,29.2,32.1,5:54:00 AM,5:42:00 PM,22.47,1.1,1.1,0,5,14.2,25.6,156,4.75,8.599998,81.20001,7,Sri Lanka,Trincomalee,2010-11-03,11,2010,0.0
11/4/2010,61,29.3,24.6,26.3,34.3,28.0,30.6,5:54:00 AM,5:42:00 PM,15.06,5.4,5.4,0,10,16.2,24.8,299,3.19,8.599998,81.20001,7,Sri Lanka,Trincomalee,2010-11-04,11,2010,1.1
11/5/2010,61,27.8,24.3,25.3,31.7,26.2,28.1,5:54:00 AM,5:42:00 PM,10.43,5.4,5.4,0,12,24.1,38.2,280,2.43,8.599998,81.20001,7,Sri Lanka,Trincomalee,2010-11-05,11,2010,5.4
11/6/2010,55,27.2,24.5,25.3,28.9,26.4,27.2,5:55:00 AM,5:42:00 PM,7.77,6.2,6.2,0,12,28.3,42.8,274,2.08,8.599998,81.20001,7,Sri Lanka,Trincomalee,2010-11-06,11,2010,5.4
11/7/2010,3,30.7,24.6,27.0,34.1,26.6,29.6,5:55:00 AM,5:42:00 PM,17.88,0.0,0.0,0,0,27.5,40.3,234,4.38,8.599998,81.20001,7,Sri Lanka,Trincomalee,2010-11-07,11,2010,6.2
11/8/2010,61,31.3,25.2,27.2,35.8,28.2,31.3,5:55:00 AM,5:42:00 PM,19.73,4.7,4.7,0,6,17.0,31.0,174,4.28,8.599998,81.20001,7,Sri Lanka,Trincomalee,2010-11-08,11,2010,0.0
11/9/2010,63,29.8,23.7,26.4,35.9,28.8,31.1,5:55:00 AM,5:41:00 PM,18.57,10.5,10.5,0,11,13.6,24.1,350,3.83,8.599998,81.20001,7,Sri Lanka,Trincomalee,2010-11-09,11,2010,4.7
11/10/2010,53,28.5,24.2,25.9,33.6,28.4,30.8,5:56:00 AM,5:41:00 PM,17.74,2.1,2.1,0,8,13.0,23.4,358,3.45,8.599998,81.20001,7,Sri Lanka,Trincomalee,2010-11-10,11,2010,10.5
11/11/2010,53,29.3,24.0,26.2,34.9,28.4,30.2,5:56:00 AM,5:41:00 PM,18.32,1.4,1.4,0,3,14.2,26.6,261,3.85,8.599998,81.20001,7,Sri Lanka,Trincomalee,2010-11-11,11,2010,2.1
11/12/2010,53,29.6,24.7,26.8,35.4,28.4,31.5,5:56:00 AM,5:41:00 PM,20.34,1.7,1.7,0,8,13.1,25.2,307,4.11,8.599998,81.20001,7,Sri Lanka,Trincomalee,2010-11-12,11,2010,1.4
11/13/2010,51,28.9,24.7,27.1,34.9,29.4,31.7,5:57:00 AM,5:41:00 PM,20.48,0.2,0.2,0,1,14.2,23.0,80,4.27,8.599998,81.20001,7,Sri Lanka,Trincomalee,2010-11-13,11,2010,1.7
11/14/2010,51,29.1,24.6,27.0,34.1,29.8,31.4,5:57:00 AM,5:41:00 PM,21.65,0.8,0.8,0,5,17.4,28.1,62,4.52,8.599998,81.20001,7,Sri Lanka,Trincomalee,2010-11-14,11,2010,0.2
11/15/2010,51,29.2,24.9,27.0,35.0,29.5,31.7,5:57:00 AM,5:41:00 PM,21.27,0.1,0.1,0,1,13.7,21.6,5,4.42,8.599998,81.20001,7,Sri Lanka,Trincomalee,2010-11-15,11,2010,0.8
11/16/2010,63,29.8,24.2,26.1,35.6,28.9,30.8,5:57:00 AM,5:41:00 PM,18.72,32.8,32.8,0,9,15.1,25.6,234,3.79,8.599998,81.20001,7,Sri Lanka,Trincomalee,2010-11-16,11,2010,0.1
11/17/2010,55,28.8,24.4,26.2,35.4,29.0,30.9,5:58:00 AM,5:41:00 PM,18.87,2.1,2.1,0,5,15.3,26.6,163,3.81,8.599998,81.20001,7,Sri Lanka,Trincomalee,2010-11-17,11,2010,32.8
11/18/2010,63,28.6,24.2,26.2,33.4,29.3,31.0,5:58:00 AM,5:41:00 PM,19.47,14.1,14.1,0,13,14.0,24.8,77,3.83,8.599998,81.20001,7,Sri Lanka,Trincomalee,2010-11-18,11,2010,2.1
11/19/2010,53,27.8,24.0,26.0,32.8,29.4,30.8,5:59:00 AM,5:41:00 PM,14.81,6.4,6.4,0,18,13.2,23.8,27,2.98,8.599998,81.20001,7,Sri Lanka,Trincomalee,2010-11-19,11,2010,14.1
11/20/2010,63,27.7,24.1,25.4,32.9,28.0,29.9,5:59:00 AM,5:41:00 PM,12.15,31.6,31.6,0,22,11.6,25.6,76,2.51,8.599998,81.20001,7,Sri Lanka,Trincomalee,2010-11-20,11,2010,6.4
11/21/2010,63,26.7,23.9,25.0,32.0,28.2,29.9,5:59:00 AM,5:41:00 PM,8.69,22.9,22.9,0,19,12.0,22.3,290,1.79,8.599998,81.20001,7,Sri Lanka,Trincomalee,2010-11-21,11,2010,31.6
11/22/2010,55,28.0,24.0,26.0,31.9,28.5,30.1,6:00:00 AM,5:42:00 PM,14.12,7.8,7.8,0,16,18.1,31.0,58,2.94,8.599998,81.20001,7,Sri Lanka,Trincomalee,2010-11-22,11,2010,22.9
11/23/2010,63,27.2,24.0,25.0,32.2,28.1,29.4,6:00:00 AM,5:42:00 PM,10.08,30.4,30.4,0,21,15.3,25.9,18,2.03,8.599998,81.20001,7,Sri Lanka,Trincomalee,2010-11-23,11,2010,7.8
11/24/2010,63,26.0,24.2,24.9,29.6,28.2,28.7,6:00:00 AM,5:42:00 PM,7.67,39.9,39.9,0,24,18.2,33.8,64,1.57,8.599998,81.20001,7,Sri Lanka,Trincomalee,2010-11-24,11,2010,30.4
11/25/2010,63,26.7,23.9,25.4,32.0,28.7,30.1,6:01:00 AM,5:42:00 PM,11.32,15.8,15.8,0,21,13.2,28.8,56,2.36,8.599998,81.20001,7,Sri Lanka,Trincomalee,2010-11-25,11,2010,39.9
11/26/2010,61,27.2,23.8,24.9,31.5,28.2,29.3,6:01:00 AM,5:42:00 PM,11.33,18.5,18.5,0,18,15.1,28.1,91,2.22,8.599998,81.20001,7,Sri Lanka,Trincomalee,2010-11-26,11,2010,15.8
11/27/2010,63,28.5,24.0,25.8,34.0,28.3,30.2,6:02:00 AM,5:42:00 PM,15.03,14.1,14.1,0,16,13.9,22.3,57,3.11,8.599998,81.20001,7,Sri Lanka,Trincomalee,2010-11-27,11,2010,18.5
11/28/2010,61,26.7,24.4,25.4,31.2,27.6,28.9,6:02:00 AM,5:43:00 PM,12.74,9.6,9.6,0,22,19.7,36.4,97,2.55,8.599998,81.20001,7,Sri Lanka,Trincomalee,2010-11-28,11,2010,14.1
11/29/2010,53,27.6,24.1,25.7,33.6,27.1,29.7,6:03:00 AM,5:43:00 PM,17.95,6.5,6.5,0,23,19.2,30.2,57,3.45,8.599998,81.20001,7,Sri Lanka,Trincomalee,2010-11-29,11,2010,9.6
11/30/2010,63,26.3,24.1,24.9,30.1,27.2,28.4,6:03:00 AM,5:43:00 PM,10.54,55.3,55.3,0,24,19.2,31.3,54,1.98,8.599998,81.20001,7,Sri Lanka,Trincomalee,2010-11-30,11,2010,6.5
12/1/2010,63,26.2,24.2,25.2,29.9,27.4,29.0,6:04:00 AM,5:43:00 PM,5.15,25.2,25.2,0,24,17.0,33.8,87,1.32,8.599998,81.20001,7,Sri Lanka,Trincomalee,2010-12-01,12,2010,55.3
12/2/2010,63,26.2,24.3,25.0,31.0,26.9,28.8,6:04:00 AM,5:44:00 PM,8.53,39.8,39.8,0,24,20.9,36.4,53,1.73,8.599998,81.20001,7,Sri Lanka,Trincomalee,2010-12-02,12,2010,25.2
12/3/2010,63,25.1,24.2,24.6,28.5,26.5,27.7,6:05:00 AM,5:44:00 PM,2.58,65.9,65.9,0,24,23.6,40.7,35,0.87,8.599998,81.20001,7,Sri Lanka,Trincomalee,2010-12-03,12,2010,39.8
12/4/2010,63,25.5,24.0,24.6,28.6,24.8,26.7,6:05:00 AM,5:44:00 PM,5.99,19.0,19.0,0,15,31.6,47.2,306,1.61,8.599998,81.20001,7,Sri Lanka,Trincomalee,2010-12-04,12,2010,65.9
12/5/2010,65,24.8,22.4,23.3,24.9,21.7,23.1,6:06:00 AM,5:45:00 PM,4.85,56.6,56.6,0,17,36.7,60.5,271,1.67,8.599998,81.20001,7,Sri Lanka,Trincomalee,2010-12-05,12,2010,19.0
12/6/2010,51,27.3,23.0,24.8,28.2,23.1,26.4,6:06:00 AM,5:45:00 PM,15.45,0.1,0.1,0,1,27.9,48.6,277,3.55,8.599998,81.20001,7,Sri Lanka,Trincomalee,2010-12-06,12,2010,56.6
12/7/2010,61,28.5,23.6,25.5,32.4,26.3,29.3,6:07:00 AM,5:45:00 PM,14.12,6.3,6.3,0,13,21.5,41.0,230,2.86,8.599998,81.20001,7,Sri Lanka,Trincomalee,2010-12-07,12,2010,0.1
12/8/2010,61,29.7,24.0,26.1,33.9,27.4,29.8,6:07:00 AM,5:46:00 PM,16.79,3.5,3.5,0,11,16.3,37.8,230,3.56,8.599998,81.20001,7,Sri Lanka,Trincomalee,2010-12-08,12,2010,6.3
12/9/2010,51,27.6,24.3,25.3,29.3,26.1,27.3,6:08:00 AM,5:46:00 PM,12.95,2.4,2.4,0,10,27.1,41.8,234,3.22,8.599998,81.20001,7,Sri Lanka,Trincomalee,2010-12-09,12,2010,3.5
12/10/2010,1,30.1,24.5,26.6,33.0,26.5,29.1,6:08:00 AM,5:46:00 PM,18.49,0.0,0.0,0,0,22.7,38.5,245,4.34,8.599998,81.20001,7,Sri Lanka,Trincomalee,2010-12-10,12,2010,2.4
12/11/2010,2,30.1,24.4,26.6,34.0,26.8,30.2,6:09:00 AM,5:47:00 PM,19.29,0.0,0.0,0,0,18.9,31.7,255,4.09,8.599998,81.20001,7,Sri Lanka,Trincomalee,2010-12-11,12,2010,0.0
12/12/2010,63,29.8,23.1,25.6,36.0,27.6,30.3,6:09:00 AM,5:47:00 PM,19.22,13.6,13.6,0,7,14.0,26.6,257,3.83,8.599998,81.20001,7,Sri Lanka,Trincomalee,2010-12-12,12,2010,0.0
12/13/2010,51,28.3,23.2,25.8,34.6,27.6,30.5,6:10:00 AM,5:47:00 PM,19.93,0.8,0.8,0,5,10.0,16.6,137,3.96,8.599998,81.20001,7,Sri Lanka,Trincomalee,2010-12-13,12,2010,13.6
12/14/2010,51,27.9,23.5,25.5,33.5,28.2,29.8,6:10:00 AM,5:48:00 PM,16.93,1.5,1.5,0,7,11.6,22.3,116,3.38,8.599998,81.20001,7,Sri Lanka,Trincomalee,2010-12-14,12,2010,0.8
12/15/2010,51,27.4,24.1,25.5,32.2,28.3,29.7,6:11:00 AM,5:48:00 PM,17.66,1.5,1.5,0,9,12.0,21.6,90,3.48,8.599998,81.20001,7,Sri Lanka,Trincomalee,2010-12-15,12,2010,1.5
12/16/2010,51,27.9,23.7,25.8,32.1,27.9,29.5,6:11:00 AM,5:49:00 PM,18.37,1.0,1.0,0,6,14.4,24.1,63,3.8,8.599998,81.20001,7,Sri Lanka,Trincomalee,2010-12-16,12,2010,1.5
12/17/2010,51,26.5,23.8,25.6,31.7,27.9,29.3,6:12:00 AM,5:49:00 PM,13.99,1.9,1.9,0,9,15.5,23.4,39,3.06,8.599998,81.20001,7,Sri Lanka,Trincomalee,2010-12-17,12,2010,1.0
12/18/2010,53,27.3,24.8,25.7,29.9,25.6,27.5,6:12:00 AM,5:50:00 PM,16.93,1.5,1.5,0,7,25.1,41.0,23,4.08,8.599998,81.20001,7,Sri Lanka,Trincomalee,2010-12-18,12,2010,1.9
12/19/2010,2,27.9,24.7,26.1,30.6,26.2,28.6,6:13:00 AM,5:50:00 PM,20.85,0.0,0.0,0,0,13.9,24.1,48,4.69,8.599998,81.20001,7,Sri Lanka,Trincomalee,2010-12-19,12,2010,1.5
12/20/2010,61,27.0,23.8,25.1,31.4,26.8,28.7,6:13:00 AM,5:51:00 PM,15.1,11.4,11.4,0,21,18.8,32.0,70,2.9,8.599998,81.20001,7,Sri Lanka,Trincomalee,2010-12-20,12,2010,0.0
12/21/2010,61,25.3,23.7,24.6,28.9,26.4,27.7,6:14:00 AM,5:51:00 PM,8.04,18.5,18.5,0,23,19.9,35.3,32,1.73,8.599998,81.20001,7,Sri Lanka,Trincomalee,2010-12-21,12,2010,11.4
12/22/2010,63,25.1,23.7,24.7,27.2,26.3,26.9,6:14:00 AM,5:52:00 PM,5.93,22.3,22.3,0,15,20.8,38.2,17,1.85,8.599998,81.20001,7,Sri Lanka,Trincomalee,2010-12-22,12,2010,18.5
12/23/2010,63,26.2,23.9,24.9,28.4,25.0,26.7,6:15:00 AM,5:52:00 PM,6.55,28.7,28.7,0,24,28.0,40.3,23,2.19,8.599998,81.20001,7,Sri Lanka,Trincomalee,2010-12-23,12,2010,22.3
12/24/2010,65,24.4,23.4,23.8,28.0,25.9,26.8,6:15:00 AM,5:53:00 PM,4.77,134.3,134.3,0,24,20.9,37.1,50,1.1,8.599998,81.20001,7,Sri Lanka,Trincomalee,2010-12-24,12,2010,28.7
12/25/2010,63,25.1,23.4,24.1,27.6,26.0,26.5,6:16:00 AM,5:53:00 PM,4.08,61.1,61.1,0,24,21.7,36.0,15,1.23,8.599998,81.20001,7,Sri Lanka,Trincomalee,2010-12-25,12,2010,134.3
12/26/2010,61,24.7,22.5,24.0,27.1,25.1,26.3,6:16:00 AM,5:54:00 PM,4.49,25.1,25.1,0,21,22.5,38.9,21,1.44,8.599998,81.20001,7,Sri Lanka,Trincomalee,2010-12-26,12,2010,61.1
12/27/2010,63,24.6,21.7,23.2,27.7,22.7,25.1,6:17:00 AM,5:54:00 PM,3.77,43.9,43.9,0,24,25.0,41.8,10,1.3,8.599998,81.20001,7,Sri Lanka,Trincomalee,2010-12-27,12,2010,25.1
12/28/2010,63,24.4,23.5,23.8,27.9,26.2,26.8,6:17:00 AM,5:55:00 PM,3.29,54.4,54.4,0,24,18.7,32.4,50,0.93,8.599998,81.20001,7,Sri Lanka,Trincomalee,2010-12-28,12,2010,43.9
12/29/2010,55,26.1,23.9,25.2,29.4,27.1,28.3,6:18:00 AM,5:55:00 PM,10.18,6.9,6.9,0,18,19.1,34.6,55,2.27,8.599998,81.20001,7,Sri Lanka,Trincomalee,2010-12-29,12,2010,54.4
12/30/2010,63,26.0,23.6,24.5,29.3,26.7,27.4,6:18:00 AM,5:56:00 PM,8.77,30.8,30.8,0,24,23.6,38.9,63,1.89,8.599998,81.20001,7,Sri Lanka,Trincomalee,2010-12-30,12,2010,6.9
12/31/2010,63,24.7,23.4,23.9,28.1,26.8,27.4,6:18:00 AM,5:56:00 PM,5.1,44.0,44.0,0,24,16.6,27.0,56,1.12,8.599998,81.20001,7,Sri Lanka,Trincomalee,2010-12-31,12,2010,30.8
1/1/2011,63,25.3,23.4,24.3,29.0,27.5,28.3,6:19:00 AM,5:57:00 PM,8.82,19.9,19.9,0,24,14.3,25.6,28,1.76,8.599998,81.20001,7,Sri Lanka,Trincomalee,2011-01-01,1,2011,44.0
1/2/2011,61,26.9,23.3,24.9,31.2,27.6,28.7,6:19:00 AM,5:57:00 PM,15.46,10.0,10.0,0,20,16.8,28.4,29,2.84,8.599998,81.20001,7,Sri Lanka,Trincomalee,2011-01-02,1,2011,19.9
1/3/2011,61,25.9,23.1,24.4,28.3,23.4,26.0,6:20:00 AM,5:58:00 PM,6.72,13.1,13.1,0,22,27.6,42.8,23,2.2,8.599998,81.20001,7,Sri Lanka,Trincomalee,2011-01-03,1,2011,10.0
1/4/2011,63,24.9,23.7,24.2,28.0,24.7,26.4,6:20:00 AM,5:58:00 PM,5.12,34.4,34.4,0,24,29.7,43.6,27,1.43,8.599998,81.20001,7,Sri Lanka,Trincomalee,2011-01-04,1,2011,13.1
1/5/2011,63,24.5,23.2,23.7,28.0,23.1,25.6,6:20:00 AM,5:59:00 PM,3.03,36.6,36.6,0,24,33.2,51.1,21,1.04,8.599998,81.20001,7,Sri Lanka,Trincomalee,2011-01-05,1,2011,34.4
1/6/2011,63,24.6,23.5,24.0,27.1,24.0,25.5,6:21:00 AM,5:59:00 PM,4.93,55.2,55.2,0,24,30.0,44.6,7,1.33,8.599998,81.20001,7,Sri Lanka,Trincomalee,2011-01-06,1,2011,36.6
1/7/2011,61,25.6,23.8,24.4,27.9,26.3,27.0,6:21:00 AM,6:00:00 PM,9.81,23.6,23.6,0,23,23.8,38.9,347,1.92,8.599998,81.20001,7,Sri Lanka,Trincomalee,2011-01-07,1,2011,55.2
1/8/2011,65,26.7,23.7,24.6,30.0,25.1,27.0,6:21:00 AM,6:00:00 PM,12.12,74.0,74.0,0,19,30.3,50.0,345,2.37,8.599998,81.20001,7,Sri Lanka,Trincomalee,2011-01-08,1,2011,23.6
1/9/2011,63,26.0,23.9,24.4,27.8,25.5,26.6,6:22:00 AM,6:01:00 PM,4.52,30.9,30.9,0,24,28.7,43.9,338,1.32,8.599998,81.20001,7,Sri Lanka,Trincomalee,2011-01-09,1,2011,74.0
1/10/2011,61,25.2,24.1,24.5,28.4,26.4,27.3,6:22:00 AM,6:01:00 PM,5.55,14.4,14.4,0,20,20.7,33.1,337,1.46,8.599998,81.20001,7,Sri Lanka,Trincomalee,2011-01-10,1,2011,30.9
1/11/2011,55,25.1,24.2,24.7,28.0,26.1,27.0,6:22:00 AM,6:02:00 PM,7.79,5.0,5.0,0,10,22.2,35.6,345,2.06,8.599998,81.20001,7,Sri Lanka,Trincomalee,2011-01-11,1,2011,14.4
1/12/2011,61,25.4,23.4,24.5,26.6,24.3,25.8,6:23:00 AM,6:03:00 PM,6.74,9.5,9.5,0,21,25.8,41.0,338,2.27,8.599998,81.20001,7,Sri Lanka,Trincomalee,2011-01-12,1,2011,5.0
1/13/2011,65,23.7,22.3,23.0,24.8,23.6,24.1,6:23:00 AM,6:03:00 PM,3.19,100.6,100.6,0,24,32.7,51.8,327,0.97,8.599998,81.20001,7,Sri Lanka,Trincomalee,2011-01-13,1,2011,9.5
1/14/2011,61,25.5,23.0,24.3,28.5,25.1,26.6,6:23:00 AM,6:04:00 PM,11.61,18.9,18.9,0,24,27.8,38.2,38,2.21,8.599998,81.20001,7,Sri Lanka,Trincomalee,2011-01-14,1,2011,100.6
1/15/2011,51,26.1,24.0,24.8,29.7,27.0,27.7,6:24:00 AM,6:04:00 PM,15.56,6.1,6.1,0,24,20.5,34.9,63,2.8,8.599998,81.20001,7,Sri Lanka,Trincomalee,2011-01-15,1,2011,18.9
1/16/2011,53,25.4,23.7,24.7,29.0,26.9,27.8,6:24:00 AM,6:05:00 PM,12.24,8.2,8.2,0,24,18.0,31.3,75,2.32,8.599998,81.20001,7,Sri Lanka,Trincomalee,2011-01-16,1,2011,6.1
1/17/2011,51,27.2,23.8,25.3,31.8,27.5,28.6,6:24:00 AM,6:05:00 PM,18.94,0.9,0.9,0,8,17.8,29.2,55,3.75,8.599998,81.20001,7,Sri Lanka,Trincomalee,2011-01-17,1,2011,8.2
1/18/2011,2,26.6,23.3,24.8,29.8,25.6,27.2,6:24:00 AM,6:05:00 PM,19.7,0.0,0.0,0,0,19.7,32.8,43,3.99,8.599998,81.20001,7,Sri Lanka,Trincomalee,2011-01-18,1,2011,0.9
1/19/2011,2,26.3,22.8,24.4,29.8,24.8,26.5,6:24:00 AM,6:06:00 PM,22.04,0.0,0.0,0,0,15.5,26.6,54,4.44,8.599998,81.20001,7,Sri Lanka,Trincomalee,2011-01-19,1,2011,0.0
1/20/2011,2,26.2,22.8,24.7,29.3,25.1,26.4,6:25:00 AM,6:06:00 PM,21.08,0.0,0.0,0,0,15.0,27.7,55,4.63,8.599998,81.20001,7,Sri Lanka,Trincomalee,2011-01-20,1,2011,0.0
1/21/2011,3,27.1,24.3,25.6,28.9,25.4,26.8,6:25:00 AM,6:07:00 PM,18.22,0.0,0.0,0,0,19.6,31.7,44,4.65,8.599998,81.20001,7,Sri Lanka,Trincomalee,2011-01-21,1,2011,0.0
1/22/2011,2,27.1,24.4,25.4,29.2,25.0,26.3,6:25:00 AM,6:07:00 PM,19.67,0.0,0.0,0,0,23.1,37.1,42,4.83,8.599998,81.20001,7,Sri Lanka,Trincomalee,2011-01-22,1,2011,0.0
1/23/2011,51,26.2,24.4,25.2,27.9,25.2,26.2,6:25:00 AM,6:08:00 PM,17.7,1.5,1.5,0,8,23.3,37.1,40,4.39,8.599998,81.20001,7,Sri Lanka,Trincomalee,2011-01-23,1,2011,0.0
1/24/2011,3,27.2,24.7,25.6,27.7,24.7,25.9,6:25:00 AM,6:08:00 PM,18.61,0.0,0.0,0,0,24.0,37.4,40,5.12,8.599998,81.20001,7,Sri Lanka,Trincomalee,2011-01-24,1,2011,1.5
1/25/2011,51,26.2,24.9,25.5,27.9,26.2,27.0,6:25:00 AM,6:08:00 PM,14.78,1.7,1.7,0,12,24.0,37.4,41,3.73,8.599998,81.20001,7,Sri Lanka,Trincomalee,2011-01-25,1,2011,0.0
1/26/2011,61,25.6,23.9,24.7,28.2,26.1,27.0,6:25:00 AM,6:09:00 PM,10.55,12.7,12.7,0,23,22.4,34.2,59,2.26,8.599998,81.20001,7,Sri Lanka,Trincomalee,2011-01-26,1,2011,1.7
1/27/2011,51,26.6,24.1,25.3,28.9,26.3,27.3,6:25:00 AM,6:09:00 PM,16.66,3.1,3.1,0,13,25.2,39.2,35,3.56,8.599998,81.20001,7,Sri Lanka,Trincomalee,2011-01-27,1,2011,12.7
1/28/2011,63,25.9,23.6,24.5,28.7,26.0,27.2,6:25:00 AM,6:09:00 PM,16.24,22.8,22.8,0,24,21.3,35.3,35,2.97,8.599998,81.20001,7,Sri Lanka,Trincomalee,2011-01-28,1,2011,3.1
1/29/2011,55,26.1,23.6,24.4,28.7,25.6,26.7,6:25:00 AM,6:10:00 PM,12.02,9.1,9.1,0,21,21.9,39.2,45,2.4,8.599998,81.20001,7,Sri Lanka,Trincomalee,2011-01-29,1,2011,22.8
1/30/2011,61,25.5,23.6,24.4,28.7,25.8,27.0,6:25:00 AM,6:10:00 PM,14.12,19.2,19.2,0,24,22.1,36.4,59,2.51,8.599998,81.20001,7,Sri Lanka,Trincomalee,2011-01-30,1,2011,9.1
1/31/2011,63,25.3,23.6,24.3,28.0,26.4,27.1,6:25:00 AM,6:11:00 PM,11.16,20.9,20.9,0,24,22.2,35.3,40,2.07,8.599998,81.20001,7,Sri Lanka,Trincomalee,2011-01-31,1,2011,19.2
2/1/2011,63,24.7,23.8,24.2,27.1,25.4,26.2,6:25:00 AM,6:11:00 PM,5.35,40.1,40.1,0,24,27.2,46.4,28,1.46,8.599998,81.20001,7,Sri Lanka,Trincomalee,2011-02-01,2,2011,20.9
2/2/2011,63,24.0,23.2,23.6,25.9,24.4,25.0,6:25:00 AM,6:11:00 PM,3.49,89.3,89.3,0,24,30.0,44.3,23,0.95,8.599998,81.20001,7,Sri Lanka,Trincomalee,2011-02-02,2,2011,40.1
2/3/2011,65,24.1,23.3,23.7,25.8,23.8,24.8,6:25:00 AM,6:11:00 PM,2.87,198.9,198.9,0,24,36.3,55.1,19,0.84,8.599998,81.20001,7,Sri Lanka,Trincomalee,2011-02-03,2,2011,89.3
2/4/2011,63,24.1,23.3,23.7,27.0,24.7,25.6,6:25:00 AM,6:12:00 PM,3.78,65.5,65.5,0,24,31.2,48.2,27,0.96,8.599998,81.20001,7,Sri Lanka,Trincomalee,2011-02-04,2,2011,198.9
2/5/2011,63,24.5,23.5,24.0,27.5,25.5,26.6,6:25:00 AM,6:12:00 PM,3.01,42.9,42.9,0,23,24.5,36.7,34,0.88,8.599998,81.20001,7,Sri Lanka,Trincomalee,2011-02-05,2,2011,65.5
2/6/2011,61,25.8,23.7,24.7,28.6,26.1,27.3,6:25:00 AM,6:12:00 PM,11.11,21.0,21.0,0,22,23.3,41.0,40,2.21,8.599998,81.20001,7,Sri Lanka,Trincomalee,2011-02-06,2,2011,42.9
2/7/2011,61,26.0,23.9,24.5,28.4,26.3,26.9,6:25:00 AM,6:13:00 PM,9.46,20.8,20.8,0,23,25.1,38.9,28,2.02,8.599998,81.20001,7,Sri Lanka,Trincomalee,2011-02-07,2,2011,21.0
2/8/2011,51,26.6,24.6,25.3,29.8,27.0,28.4,6:25:00 AM,6:13:00 PM,11.29,4.2,4.2,0,21,20.3,33.5,24,2.44,8.599998,81.20001,7,Sri Lanka,Trincomalee,2011-02-08,2,2011,20.8
2/9/2011,51,26.5,24.2,25.2,29.5,27.1,28.0,6:24:00 AM,6:13:00 PM,16.6,1.7,1.7,0,9,21.9,35.6,21,3.26,8.599998,81.20001,7,Sri Lanka,Trincomalee,2011-02-09,2,2011,4.2
2/10/2011,3,26.7,24.2,25.4,30.2,25.9,27.3,6:24:00 AM,6:13:00 PM,21.03,0.0,0.0,0,0,21.7,34.6,23,4.61,8.599998,81.20001,7,Sri Lanka,Trincomalee,2011-02-10,2,2011,1.7
2/11/2011,3,26.9,24.5,25.7,28.7,25.7,27.0,6:24:00 AM,6:14:00 PM,19.91,0.0,0.0,0,0,20.6,33.1,41,4.86,8.599998,81.20001,7,Sri Lanka,Trincomalee,2011-02-11,2,2011,0.0
2/12/2011,3,27.3,24.4,25.5,29.5,25.3,26.6,6:24:00 AM,6:14:00 PM,21.95,0.0,0.0,0,0,21.7,34.2,36,5.22,8.599998,81.20001,7,Sri Lanka,Trincomalee,2011-02-12,2,2011,0.0
2/13/2011,3,27.0,24.4,25.6,29.2,25.6,27.1,6:24:00 AM,6:14:00 PM,20.3,0.0,0.0,0,0,17.3,28.4,43,4.75,8.599998,81.20001,7,Sri Lanka,Trincomalee,2011-02-13,2,2011,0.0
2/14/2011,3,27.8,24.7,25.9,31.1,26.4,28.5,6:23:00 AM,6:14:00 PM,19.44,0.0,0.0,0,0,18.2,28.4,53,4.3,8.599998,81.20001,7,Sri Lanka,Trincomalee,2011-02-14,2,2011,0.0
2/15/2011,51,26.5,24.0,25.4,30.1,28.5,29.3,6:23:00 AM,6:14:00 PM,9.92,0.6,0.6,0,3,12.0,19.8,44,2.22,8.599998,81.20001,7,Sri Lanka,Trincomalee,2011-02-15,2,2011,0.0
2/16/2011,51,27.5,23.8,25.8,33.1,28.9,30.5,6:23:00 AM,6:14:00 PM,20.4,0.3,0.3,0,2,10.0,18.4,29,3.92,8.599998,81.20001,7,Sri Lanka,Trincomalee,2011-02-16,2,2011,0.6
2/17/2011,2,28.9,23.6,26.1,35.1,28.3,30.8,6:23:00 AM,6:15:00 PM,22.33,0.0,0.0,0,0,15.3,24.8,83,4.39,8.599998,81.20001,7,Sri Lanka,Trincomalee,2011-02-17,2,2011,0.3
2/18/2011,3,29.2,23.5,26.2,35.9,28.5,31.0,6:22:00 AM,6:15:00 PM,22.5,0.0,0.0,0,0,13.3,23.4,102,4.55,8.599998,81.20001,7,Sri Lanka,Trincomalee,2011-02-18,2,2011,0.0
2/19/2011,1,28.9,24.8,26.7,34.9,29.6,31.4,6:22:00 AM,6:15:00 PM,21.79,0.0,0.0,0,0,11.3,19.4,95,4.54,8.599998,81.20001,7,Sri Lanka,Trincomalee,2011-02-19,2,2011,0.0
2/20/2011,51,29.0,24.9,26.8,34.9,29.3,31.5,6:22:00 AM,6:15:00 PM,21.77,0.7,0.7,0,5,12.8,25.9,106,4.27,8.599998,81.20001,7,Sri Lanka,Trincomalee,2011-02-20,2,2011,0.0
2/21/2011,51,28.4,24.7,26.1,34.6,29.0,31.2,6:21:00 AM,6:15:00 PM,20.29,1.9,1.9,0,12,13.5,25.2,102,3.89,8.599998,81.20001,7,Sri Lanka,Trincomalee,2011-02-21,2,2011,0.7
2/22/2011,51,28.3,25.1,26.5,32.3,28.3,29.7,6:21:00 AM,6:15:00 PM,23.0,0.7,0.7,0,4,19.4,32.4,77,4.84,8.599998,81.20001,7,Sri Lanka,Trincomalee,2011-02-22,2,2011,1.9
2/23/2011,2,28.4,25.3,26.7,32.1,28.1,29.6,6:21:00 AM,6:15:00 PM,23.08,0.0,0.0,0,0,18.7,31.3,59,4.99,8.599998,81.20001,7,Sri Lanka,Trincomalee,2011-02-23,2,2011,0.7
2/24/2011,3,28.3,25.0,26.4,32.4,28.0,29.4,6:20:00 AM,6:15:00 PM,22.5,0.0,0.0,0,0,18.0,29.9,55,4.81,8.599998,81.20001,7,Sri Lanka,Trincomalee,2011-02-24,2,2011,0.0
2/25/2011,3,28.2,23.9,26.0,33.3,27.4,29.2,6:20:00 AM,6:15:00 PM,21.71,0.0,0.0,0,0,16.5,27.4,33,4.69,8.599998,81.20001,7,Sri Lanka,Trincomalee,2011-02-25,2,2011,0.0
2/26/2011,2,28.3,24.0,26.1,32.5,27.2,28.9,6:19:00 AM,6:16:00 PM,21.83,0.0,0.0,0,0,16.8,28.1,47,4.77,8.599998,81.20001,7,Sri Lanka,Trincomalee,2011-02-26,2,2011,0.0
2/27/2011,51,28.3,23.4,25.9,31.6,26.7,28.7,6:19:00 AM,6:16:00 PM,19.61,2.1,2.1,0,8,17.3,28.1,33,4.33,8.599998,81.20001,7,Sri Lanka,Trincomalee,2011-02-27,2,2011,0.0
2/28/2011,63,27.0,24.3,25.5,30.2,27.5,28.4,6:19:00 AM,6:16:00 PM,16.03,12.4,12.4,0,22,22.6,38.9,38,3.31,8.599998,81.20001,7,Sri Lanka,Trincomalee,2011-02-28,2,2011,2.1
3/1/2011,61,27.3,24.4,25.5,30.3,27.5,28.2,6:18:00 AM,6:16:00 PM,11.64,10.2,10.2,0,21,22.3,36.4,54,2.82,8.599998,81.20001,7,Sri Lanka,Trincomalee,2011-03-01,3,2011,12.4
3/2/2011,61,27.1,24.5,25.6,30.3,27.1,28.5,6:18:00 AM,6:16:00 PM,17.94,12.2,12.2,0,22,21.7,34.9,54,3.66,8.599998,81.20001,7,Sri Lanka,Trincomalee,2011-03-02,3,2011,10.2
3/3/2011,61,27.4,24.3,25.6,31.1,27.9,29.3,6:17:00 AM,6:16:00 PM,16.96,7.1,7.1,0,20,16.2,29.2,91,3.36,8.599998,81.20001,7,Sri Lanka,Trincomalee,2011-03-03,3,2011,12.2
3/4/2011,53,27.8,24.6,26.1,32.8,28.8,30.2,6:17:00 AM,6:16:00 PM,20.33,2.0,2.0,0,10,18.5,30.6,63,3.96,8.599998,81.20001,7,Sri Lanka,Trincomalee,2011-03-04,3,2011,7.1
3/5/2011,51,28.7,24.2,26.4,34.0,29.1,30.5,6:17:00 AM,6:16:00 PM,22.78,0.7,0.7,0,5,17.1,29.9,62,4.58,8.599998,81.20001,7,Sri Lanka,Trincomalee,2011-03-05,3,2011,2.0
3/6/2011,1,28.8,25.0,26.7,34.4,28.5,30.7,6:16:00 AM,6:16:00 PM,23.59,0.0,0.0,0,0,15.6,26.6,53,4.83,8.599998,81.20001,7,Sri Lanka,Trincomalee,2011-03-06,3,2011,0.7
3/7/2011,2,28.0,24.0,25.9,33.3,27.9,29.4,6:16:00 AM,6:16:00 PM,24.8,0.0,0.0,0,0,14.4,24.8,41,4.99,8.599998,81.20001,7,Sri Lanka,Trincomalee,2011-03-07,3,2011,0.0
3/8/2011,2,29.4,22.9,26.2,35.4,27.3,30.6,6:15:00 AM,6:16:00 PM,25.75,0.0,0.0,0,0,8.7,17.6,71,5.15,8.599998,81.20001,7,Sri Lanka,Trincomalee,2011-03-08,3,2011,0.0
3/9/2011,3,29.9,22.2,26.2,36.2,26.6,30.7,6:15:00 AM,6:16:00 PM,25.75,0.0,0.0,0,0,10.7,17.3,93,5.28,8.599998,81.20001,7,Sri Lanka,Trincomalee,2011-03-09,3,2011,0.0
3/10/2011,3,29.6,23.0,26.0,35.8,27.5,30.1,6:14:00 AM,6:16:00 PM,26.22,0.0,0.0,0,0,13.4,23.4,79,5.41,8.599998,81.20001,7,Sri Lanka,Trincomalee,2011-03-10,3,2011,0.0
3/11/2011,51,28.8,23.2,26.5,34.1,27.4,30.3,6:14:00 AM,6:16:00 PM,24.8,0.1,0.1,0,1,15.3,23.0,48,5.19,8.599998,81.20001,7,Sri Lanka,Trincomalee,2011-03-11,3,2011,0.0
3/12/2011,53,28.6,25.1,26.4,34.5,29.0,30.9,6:13:00 AM,6:16:00 PM,19.67,2.7,2.7,0,16,18.4,28.1,30,3.95,8.599998,81.20001,7,Sri Lanka,Trincomalee,2011-03-12,3,2011,0.1
3/13/2011,51,28.7,24.9,26.4,33.0,28.8,30.2,6:13:00 AM,6:16:00 PM,20.87,2.4,2.4,0,16,23.6,37.1,14,4.03,8.599998,81.20001,7,Sri Lanka,Trincomalee,2011-03-13,3,2011,2.7
3/14/2011,61,28.0,25.0,26.2,31.9,28.5,29.7,6:12:00 AM,6:16:00 PM,18.22,8.4,8.4,0,21,22.6,36.0,19,3.62,8.599998,81.20001,7,Sri Lanka,Trincomalee,2011-03-14,3,2011,2.4
3/15/2011,53,28.3,24.6,26.4,32.6,28.3,29.7,6:12:00 AM,6:16:00 PM,19.92,5.1,5.1,0,15,24.2,39.6,24,4.02,8.599998,81.20001,7,Sri Lanka,Trincomalee,2011-03-15,3,2011,8.4
3/16/2011,53,28.4,24.2,26.3,33.8,27.7,30.1,6:11:00 AM,6:16:00 PM,21.95,4.6,4.6,0,16,21.8,39.2,35,4.3,8.599998,81.20001,7,Sri Lanka,Trincomalee,2011-03-16,3,2011,5.1
3/17/2011,2,28.6,25.5,26.8,32.2,27.8,29.2,6:11:00 AM,6:16:00 PM,25.2,0.0,0.0,0,0,24.4,39.2,38,5.46,8.599998,81.20001,7,Sri Lanka,Trincomalee,2011-03-17,3,2011,4.6
3/18/2011,51,27.7,25.3,26.2,30.7,27.6,29.3,6:10:00 AM,6:15:00 PM,15.85,1.1,1.1,0,5,21.2,34.6,44,3.57,8.599998,81.20001,7,Sri Lanka,Trincomalee,2011-03-18,3,2011,0.0
3/19/2011,51,28.9,25.0,27.1,34.8,30.5,31.8,6:09:00 AM,6:15:00 PM,23.07,0.1,0.1,0,1,15.5,26.6,73,4.63,8.599998,81.20001,7,Sri Lanka,Trincomalee,2011-03-19,3,2011,1.1
3/20/2011,51,29.4,25.1,27.2,36.0,29.9,32.4,6:09:00 AM,6:15:00 PM,24.42,0.3,0.3,0,2,15.3,26.6,93,4.89,8.599998,81.20001,7,Sri Lanka,Trincomalee,2011-03-20,3,2011,0.1
3/21/2011,53,29.6,25.1,27.0,36.7,29.6,32.3,6:08:00 AM,6:15:00 PM,22.6,1.0,1.0,0,3,14.0,24.1,170,4.52,8.599998,81.20001,7,Sri Lanka,Trincomalee,2011-03-21,3,2011,0.3
3/22/2011,1,31.1,24.9,27.6,37.8,29.2,32.4,6:08:00 AM,6:15:00 PM,24.97,0.0,0.0,0,0,15.9,26.3,106,5.24,8.599998,81.20001,7,Sri Lanka,Trincomalee,2011-03-22,3,2011,1.0
3/23/2011,51,29.9,25.2,27.4,36.6,30.5,32.4,6:07:00 AM,6:15:00 PM,23.57,0.1,0.1,0,1,13.9,23.0,105,4.94,8.599998,81.20001,7,Sri Lanka,Trincomalee,2011-03-23,3,2011,0.0
3/24/2011,55,30.3,25.5,27.1,37.1,30.6,32.4,6:07:00 AM,6:15:00 PM,22.14,3.1,3.1,0,9,11.9,27.0,124,4.52,8.599998,81.20001,7,Sri Lanka,Trincomalee,2011-03-24,3,2011,0.1
3/25/2011,51,30.5,24.9,27.4,37.6,30.4,32.7,6:06:00 AM,6:15:00 PM,23.18,0.9,0.9,0,3,17.5,29.2,112,4.8,8.599998,81.20001,7,Sri Lanka,Trincomalee,2011-03-25,3,2011,3.1
3/26/2011,51,30.3,24.9,27.4,37.6,30.2,32.7,6:06:00 AM,6:15:00 PM,24.53,0.7,0.7,0,4,13.5,25.2,95,5.03,8.599998,81.20001,7,Sri Lanka,Trincomalee,2011-03-26,3,2011,0.9
3/27/2011,1,30.1,24.7,27.6,36.8,29.7,32.7,6:05:00 AM,6:15:00 PM,24.96,0.0,0.0,0,0,14.3,22.7,85,5.22,8.599998,81.20001,7,Sri Lanka,Trincomalee,2011-03-27,3,2011,0.7
3/28/2011,51,30.3,25.6,27.7,37.4,31.0,32.9,6:05:00 AM,6:15:00 PM,24.45,0.1,0.1,0,1,13.9,24.8,111,5.14,8.599998,81.20001,7,Sri Lanka,Trincomalee,2011-03-28,3,2011,0.0
3/29/2011,1,30.6,25.6,27.8,37.1,30.5,32.9,6:04:00 AM,6:15:00 PM,24.77,0.0,0.0,0,0,14.6,25.6,103,5.22,8.599998,81.20001,7,Sri Lanka,Trincomalee,2011-03-29,3,2011,0.1
3/30/2011,1,30.6,25.1,27.6,36.3,29.0,31.9,6:04:00 AM,6:15:00 PM,26.05,0.0,0.0,0,0,14.2,23.8,113,5.63,8.599998,81.20001,7,Sri Lanka,Trincomalee,2011-03-30,3,2011,0.0
3/31/2011,0,31.6,24.9,27.8,37.5,28.8,32.0,6:03:00 AM,6:15:00 PM,27.24,0.0,0.0,0,0,14.8,23.8,133,5.89,8.599998,81.20001,7,Sri Lanka,Trincomalee,2011-03-31,3,2011,0.0
4/1/2011,1,32.1,24.7,27.9,38.9,29.4,32.6,6:03:00 AM,6:15:00 PM,26.58,0.0,0.0,0,0,15.8,26.3,134,5.76,8.599998,81.20001,7,Sri Lanka,Trincomalee,2011-04-01,4,2011,0.0
4/2/2011,51,32.6,25.3,28.3,38.8,29.8,33.3,6:02:00 AM,6:15:00 PM,25.46,0.3,0.3,0,2,14.7,24.5,142,5.53,8.599998,81.20001,7,Sri Lanka,Trincomalee,2011-04-02,4,2011,0.0
4/3/2011,51,32.6,25.8,28.6,39.0,29.5,33.1,6:01:00 AM,6:15:00 PM,24.87,0.4,0.4,0,3,15.5,24.5,168,5.58,8.599998,81.20001,7,Sri Lanka,Trincomalee,2011-04-03,4,2011,0.3
4/4/2011,51,32.4,25.5,28.4,38.6,29.3,32.8,6:01:00 AM,6:14:00 PM,27.08,0.3,0.3,0,2,18.7,30.2,140,6.05,8.599998,81.20001,7,Sri Lanka,Trincomalee,2011-04-04,4,2011,0.4
4/5/2011,51,31.6,25.5,28.2,37.2,29.6,32.3,6:00:00 AM,6:14:00 PM,26.86,0.1,0.1,0,1,17.3,30.2,109,6.03,8.599998,81.20001,7,Sri Lanka,Trincomalee,2011-04-05,4,2011,0.3
4/6/2011,1,30.8,25.5,27.9,35.5,29.7,31.7,6:00:00 AM,6:14:00 PM,26.52,0.0,0.0,0,0,15.5,27.4,104,5.84,8.599998,81.20001,7,Sri Lanka,Trincomalee,2011-04-06,4,2011,0.1
4/7/2011,51,29.2,25.6,27.3,34.0,29.5,31.3,5:59:00 AM,6:14:00 PM,20.31,1.1,1.1,0,8,16.9,28.1,83,4.36,8.599998,81.20001,7,Sri Lanka,Trincomalee,2011-04-07,4,2011,0.0
4/8/2011,51,30.6,25.5,28.0,36.9,30.3,33.0,5:59:00 AM,6:14:00 PM,22.74,0.2,0.2,0,1,14.0,25.2,101,4.84,8.599998,81.20001,7,Sri Lanka,Trincomalee,2011-04-08,4,2011,1.1
4/9/2011,1,30.7,25.9,28.2,36.7,30.8,33.0,5:58:00 AM,6:14:00 PM,24.38,0.0,0.0,0,0,15.5,23.4,124,5.27,8.599998,81.20001,7,Sri Lanka,Trincomalee,2011-04-09,4,2011,0.2
4/10/2011,55,30.8,25.7,27.7,37.2,30.7,32.7,5:58:00 AM,6:14:00 PM,23.1,2.3,2.3,0,5,17.3,35.6,97,4.85,8.599998,81.20001,7,Sri Lanka,Trincomalee,2011-04-10,4,2011,0.0
4/11/2011,61,30.3,25.2,27.4,35.9,29.5,31.9,5:57:00 AM,6:14:00 PM,21.91,4.8,4.8,0,11,16.1,26.6,97,4.67,8.599998,81.20001,7,Sri Lanka,Trincomalee,2011-04-11,4,2011,2.3
4/12/2011,53,30.2,25.2,27.5,36.4,29.8,32.7,5:57:00 AM,6:14:00 PM,20.73,0.8,0.8,0,3,13.4,25.9,114,4.3,8.599998,81.20001,7,Sri Lanka,Trincomalee,2011-04-12,4,2011,4.8
4/13/2011,51,30.5,25.7,27.9,37.8,30.3,32.9,5:56:00 AM,6:14:00 PM,24.0,0.4,0.4,0,1,14.8,27.0,130,5.1,8.599998,81.20001,7,Sri Lanka,Trincomalee,2011-04-13,4,2011,0.8
4/14/2011,51,31.3,25.6,27.9,38.0,29.9,32.7,5:56:00 AM,6:14:00 PM,23.78,0.5,0.5,0,2,15.9,27.0,278,5.07,8.599998,81.20001,7,Sri Lanka,Trincomalee,2011-04-14,4,2011,0.4
4/15/2011,51,30.9,25.4,28.1,37.3,29.6,32.8,5:55:00 AM,6:14:00 PM,23.87,0.6,0.6,0,2,16.8,29.2,90,5.2,8.599998,81.20001,7,Sri Lanka,Trincomalee,2011-04-15,4,2011,0.5
4/16/2011,55,30.8,25.3,27.8,37.4,30.9,32.9,5:55:00 AM,6:14:00 PM,22.87,3.8,3.8,0,11,15.1,26.3,109,4.9,8.599998,81.20001,7,Sri Lanka,Trincomalee,2011-04-16,4,2011,0.6
4/17/2011,61,30.6,25.1,27.3,37.2,29.4,32.5,5:55:00 AM,6:14:00 PM,22.36,5.4,5.4,0,9,13.8,26.3,137,4.57,8.599998,81.20001,7,Sri Lanka,Trincomalee,2011-04-17,4,2011,3.8
4/18/2011,53,30.7,25.2,27.6,37.9,29.4,32.5,5:54:00 AM,6:14:00 PM,22.01,1.4,1.4,0,4,14.6,23.8,170,4.7,8.599998,81.20001,7,Sri Lanka,Trincomalee,2011-04-18,4,2011,5.4
4/19/2011,61,31.2,25.3,27.3,38.8,29.2,32.4,5:54:00 AM,6:14:00 PM,24.41,10.5,10.5,0,7,14.1,25.2,260,5.08,8.599998,81.20001,7,Sri Lanka,Trincomalee,2011-04-19,4,2011,1.4
4/20/2011,55,31.0,25.5,27.7,37.6,29.5,33.0,5:53:00 AM,6:14:00 PM,20.69,3.8,3.8,0,10,13.6,23.4,232,4.34,8.599998,81.20001,7,Sri Lanka,Trincomalee,2011-04-20,4,2011,10.5
4/21/2011,61,30.3,25.6,27.3,37.6,30.6,32.7,5:53:00 AM,6:14:00 PM,21.93,6.1,6.1,0,11,13.7,24.5,230,4.52,8.599998,81.20001,7,Sri Lanka,Trincomalee,2011-04-21,4,2011,3.8
4/22/2011,61,28.4,25.3,26.4,34.7,29.2,31.5,5:52:00 AM,6:14:00 PM,13.32,7.9,7.9,0,15,13.3,22.3,249,2.77,8.599998,81.20001,7,Sri Lanka,Trincomalee,2011-04-22,4,2011,6.1
4/23/2011,53,27.4,25.2,26.2,32.1,29.1,30.2,5:52:00 AM,6:14:00 PM,7.96,2.3,2.3,0,9,16.6,29.9,239,2.01,8.599998,81.20001,7,Sri Lanka,Trincomalee,2011-04-23,4,2011,7.9
4/24/2011,65,31.1,25.3,27.0,37.4,29.6,31.9,5:52:00 AM,6:14:00 PM,18.37,18.5,18.5,0,5,15.9,25.9,223,3.86,8.599998,81.20001,7,Sri Lanka,Trincomalee,2011-04-24,4,2011,2.3
4/25/2011,65,29.0,25.3,26.6,35.8,29.0,31.8,5:51:00 AM,6:14:00 PM,18.45,38.1,38.1,0,12,12.7,26.3,193,3.69,8.599998,81.20001,7,Sri Lanka,Trincomalee,2011-04-25,4,2011,18.5
4/26/2011,63,29.6,25.2,26.5,35.3,28.6,31.1,5:51:00 AM,6:14:00 PM,18.44,11.9,11.9,0,12,16.1,29.2,273,3.64,8.599998,81.20001,7,Sri Lanka,Trincomalee,2011-04-26,4,2011,38.1
4/27/2011,65,29.7,25.0,26.4,37.2,28.8,31.3,5:50:00 AM,6:14:00 PM,16.14,26.7,26.7,0,18,16.9,28.1,247,3.34,8.599998,81.20001,7,Sri Lanka,Trincomalee,2011-04-27,4,2011,11.9
4/28/2011,63,29.6,25.5,26.6,33.9,28.2,30.1,5:50:00 AM,6:14:00 PM,12.62,12.9,12.9,0,6,24.5,40.0,241,2.98,8.599998,81.20001,7,Sri Lanka,Trincomalee,2011-04-28,4,2011,26.7
4/29/2011,51,33.0,26.0,29.0,39.4,28.5,33.1,5:50:00 AM,6:14:00 PM,24.02,0.2,0.2,0,1,26.3,46.1,245,5.53,8.599998,81.20001,7,Sri Lanka,Trincomalee,2011-04-29,4,2011,12.9
4/30/2011,53,32.5,26.4,28.5,37.8,29.1,32.3,5:49:00 AM,6:14:00 PM,23.16,0.5,0.5,0,1,25.1,42.1,241,5.36,8.599998,81.20001,7,Sri Lanka,Trincomalee,2011-04-30,4,2011,0.2
5/1/2011,51,32.0,25.8,28.2,36.9,28.4,31.6,5:49:00 AM,6:14:00 PM,22.77,0.4,0.4,0,2,26.4,43.2,243,5.28,8.599998,81.20001,7,Sri Lanka,Trincomalee,2011-05-01,5,2011,0.5
5/2/2011,51,30.9,25.7,27.8,35.1,28.1,30.4,5:49:00 AM,6:15:00 PM,21.88,0.2,0.2,0,1,30.0,46.8,245,5.12,8.599998,81.20001,7,Sri Lanka,Trincomalee,2011-05-02,5,2011,0.4
5/3/2011,51,32.2,26.2,28.5,37.1,28.4,31.3,5:48:00 AM,6:15:00 PM,23.75,0.2,0.2,0,1,30.3,47.2,244,5.69,8.599998,81.20001,7,Sri Lanka,Trincomalee,2011-05-03,5,2011,0.2
5/4/2011,51,33.2,26.3,29.0,38.2,28.5,32.4,5:48:00 AM,6:15:00 PM,24.8,0.3,0.3,0,1,30.1,45.7,247,5.9,8.599998,81.20001,7,Sri Lanka,Trincomalee,2011-05-04,5,2011,0.2
5/5/2011,1,33.1,26.8,29.3,38.3,28.8,32.6,5:48:00 AM,6:15:00 PM,22.73,0.0,0.0,0,0,26.9,42.5,241,5.83,8.599998,81.20001,7,Sri Lanka,Trincomalee,2011-05-05,5,2011,0.3
5/6/2011,1,33.5,26.7,29.4,37.6,28.7,32.3,5:48:00 AM,6:15:00 PM,23.57,0.0,0.0,0,0,30.6,47.9,241,6.07,8.599998,81.20001,7,Sri Lanka,Trincomalee,2011-05-06,5,2011,0.0
5/7/2011,51,33.6,27.0,29.5,37.6,29.2,32.1,5:47:00 AM,6:15:00 PM,24.49,0.2,0.2,0,1,29.6,46.1,238,6.42,8.599998,81.20001,7,Sri Lanka,Trincomalee,2011-05-07,5,2011,0.0
5/8/2011,1,33.9,26.6,29.6,37.9,28.6,32.1,5:47:00 AM,6:15:00 PM,25.31,0.0,0.0,0,0,29.0,47.9,238,6.77,8.599998,81.20001,7,Sri Lanka,Trincomalee,2011-05-08,5,2011,0.2
5/9/2011,1,33.9,26.0,29.3,36.7,28.0,31.6,5:47:00 AM,6:15:00 PM,26.41,0.0,0.0,0,0,26.1,43.9,235,6.89,8.599998,81.20001,7,Sri Lanka,Trincomalee,2011-05-09,5,2011,0.0
5/10/2011,1,34.1,26.0,29.4,37.9,28.1,32.3,5:47:00 AM,6:15:00 PM,24.99,0.0,0.0,0,0,25.8,43.6,233,6.4,8.599998,81.20001,7,Sri Lanka,Trincomalee,2011-05-10,5,2011,0.0
5/11/2011,1,33.7,25.9,29.1,38.0,28.1,32.2,5:46:00 AM,6:16:00 PM,25.1,0.0,0.0,0,0,22.5,39.2,235,6.21,8.599998,81.20001,7,Sri Lanka,Trincomalee,2011-05-11,5,2011,0.0
5/12/2011,1,32.9,25.7,29.1,38.1,28.8,33.2,5:46:00 AM,6:16:00 PM,24.69,0.0,0.0,0,0,16.7,29.9,225,5.71,8.599998,81.20001,7,Sri Lanka,Trincomalee,2011-05-12,5,2011,0.0
5/13/2011,1,33.7,25.6,29.3,39.1,28.1,32.8,5:46:00 AM,6:16:00 PM,25.59,0.0,0.0,0,0,20.0,31.7,233,6.15,8.599998,81.20001,7,Sri Lanka,Trincomalee,2011-05-13,5,2011,0.0
5/14/2011,0,34.7,25.5,29.7,38.0,27.9,32.3,5:46:00 AM,6:16:00 PM,27.04,0.0,0.0,0,0,18.0,32.8,227,6.56,8.599998,81.20001,7,Sri Lanka,Trincomalee,2011-05-14,5,2011,0.0
5/15/2011,0,34.0,26.2,29.7,40.1,30.1,34.3,5:46:00 AM,6:16:00 PM,25.02,0.0,0.0,0,0,14.2,28.8,225,5.67,8.599998,81.20001,7,Sri Lanka,Trincomalee,2011-05-15,5,2011,0.0
5/16/2011,51,33.2,26.2,29.1,39.7,30.8,34.1,5:45:00 AM,6:16:00 PM,26.01,0.5,0.5,0,4,19.0,31.0,127,5.86,8.599998,81.20001,7,Sri Lanka,Trincomalee,2011-05-16,5,2011,0.0
5/17/2011,53,32.3,26.4,28.8,39.6,31.1,34.0,5:45:00 AM,6:17:00 PM,24.72,1.2,1.2,0,2,15.2,28.4,167,5.33,8.599998,81.20001,7,Sri Lanka,Trincomalee,2011-05-17,5,2011,0.5
5/18/2011,51,32.0,26.2,28.7,38.5,30.8,33.6,5:45:00 AM,6:17:00 PM,22.83,0.4,0.4,0,3,14.2,26.6,163,5.11,8.599998,81.20001,7,Sri Lanka,Trincomalee,2011-05-18,5,2011,1.2
5/19/2011,1,32.9,26.5,29.5,38.6,29.7,33.7,5:45:00 AM,6:17:00 PM,25.02,0.0,0.0,0,0,15.1,24.5,186,6.01,8.599998,81.20001,7,Sri Lanka,Trincomalee,2011-05-19,5,2011,0.4
5/20/2011,51,34.2,26.5,29.8,39.0,29.4,33.6,5:45:00 AM,6:17:00 PM,24.67,0.1,0.1,0,1,20.1,33.8,220,6.06,8.599998,81.20001,7,Sri Lanka,Trincomalee,2011-05-20,5,2011,0.0
5/21/2011,1,34.8,26.6,30.1,39.5,29.1,33.1,5:45:00 AM,6:17:00 PM,24.98,0.0,0.0,0,0,20.4,35.6,229,6.56,8.599998,81.20001,7,Sri Lanka,Trincomalee,2011-05-21,5,2011,0.1
5/22/2011,61,34.7,26.6,29.3,39.5,29.0,32.7,5:45:00 AM,6:18:00 PM,24.08,3.0,3.0,0,3,22.7,37.8,233,6.06,8.599998,81.20001,7,Sri Lanka,Trincomalee,2011-05-22,5,2011,0.0
5/23/2011,55,33.7,26.7,29.6,39.3,29.7,33.6,5:45:00 AM,6:18:00 PM,23.49,1.1,1.1,0,1,21.0,33.1,218,5.76,8.599998,81.20001,7,Sri Lanka,Trincomalee,2011-05-23,5,2011,3.0
5/24/2011,1,33.9,26.7,29.9,40.3,29.9,34.2,5:45:00 AM,6:18:00 PM,24.53,0.0,0.0,0,0,18.3,31.0,203,5.9,8.599998,81.20001,7,Sri Lanka,Trincomalee,2011-05-24,5,2011,1.1
5/25/2011,53,33.4,26.8,29.2,40.7,30.6,33.8,5:45:00 AM,6:18:00 PM,24.23,1.4,1.4,0,3,17.5,28.4,201,5.65,8.599998,81.20001,7,Sri Lanka,Trincomalee,2011-05-25,5,2011,0.0
5/26/2011,53,34.0,26.7,29.4,39.4,29.4,33.3,5:45:00 AM,6:18:00 PM,23.04,1.6,1.6,0,4,23.1,39.2,238,5.61,8.599998,81.20001,7,Sri Lanka,Trincomalee,2011-05-26,5,2011,1.4
5/27/2011,2,33.6,26.4,29.4,36.6,28.8,31.7,5:45:00 AM,6:19:00 PM,23.64,0.0,0.0,0,0,28.0,44.3,243,6.5,8.599998,81.20001,7,Sri Lanka,Trincomalee,2011-05-27,5,2011,1.6
5/28/2011,51,33.6,26.5,29.1,36.1,27.9,30.7,5:45:00 AM,6:19:00 PM,22.36,0.2,0.2,0,1,34.4,57.6,242,6.36,8.599998,81.20001,7,Sri Lanka,Trincomalee,2011-05-28,5,2011,0.0
5/29/2011,51,34.7,26.4,29.8,37.1,28.0,31.4,5:45:00 AM,6:19:00 PM,24.24,0.3,0.3,0,1,33.4,59.4,246,7.08,8.599998,81.20001,7,Sri Lanka,Trincomalee,2011-05-29,5,2011,0.2
5/30/2011,51,33.8,26.4,29.5,36.3,27.2,31.0,5:45:00 AM,6:19:00 PM,23.35,0.1,0.1,0,1,32.1,56.5,241,6.77,8.599998,81.20001,7,Sri Lanka,Trincomalee,2011-05-30,5,2011,0.3
5/31/2011,51,33.6,26.3,29.2,36.1,27.1,30.5,5:45:00 AM,6:20:00 PM,22.13,0.3,0.3,0,2,36.2,62.6,242,6.53,8.599998,81.20001,7,Sri Lanka,Trincomalee,2011-05-31,5,2011,0.1
6/1/2011,53,33.1,25.9,28.6,34.3,26.9,29.5,5:45:00 AM,6:20:00 PM,21.39,2.0,2.0,0,6,36.4,63.0,242,6.16,8.599998,81.20001,7,Sri Lanka,Trincomalee,2011-06-01,6,2011,0.3
6/2/2011,3,32.2,26.1,28.7,32.4,27.4,30.2,5:45:00 AM,6:20:00 PM,14.59,0.0,0.0,0,0,30.1,49.3,247,5.08,8.599998,81.20001,7,Sri Lanka,Trincomalee,2011-06-02,6,2011,2.0
6/3/2011,2,33.9,26.4,29.4,36.6,28.8,31.6,5:45:00 AM,6:21:00 PM,22.48,0.0,0.0,0,0,26.1,42.8,244,6.42,8.599998,81.20001,7,Sri Lanka,Trincomalee,2011-06-03,6,2011,0.0
6/4/2011,51,34.2,26.5,29.5,36.7,28.4,31.6,5:45:00 AM,6:21:00 PM,21.7,0.2,0.2,0,1,27.6,44.6,244,6.39,8.599998,81.20001,7,Sri Lanka,Trincomalee,2011-06-04,6,2011,0.0
6/5/2011,1,35.1,26.5,30.0,37.7,28.5,32.0,5:45:00 AM,6:21:00 PM,22.7,0.0,0.0,0,0,27.5,45.7,244,6.78,8.599998,81.20001,7,Sri Lanka,Trincomalee,2011-06-05,6,2011,0.2
6/6/2011,51,33.9,26.9,29.4,36.5,29.2,31.6,5:45:00 AM,6:21:00 PM,19.35,0.2,0.2,0,1,28.8,48.6,239,5.79,8.599998,81.20001,7,Sri Lanka,Trincomalee,2011-06-06,6,2011,0.0
6/7/2011,51,34.5,27.0,29.6,37.8,29.0,32.2,5:45:00 AM,6:22:00 PM,21.77,0.2,0.2,0,1,24.4,37.8,242,6.22,8.599998,81.20001,7,Sri Lanka,Trincomalee,2011-06-07,6,2011,0.2
6/8/2011,1,34.4,26.9,29.8,37.1,28.9,32.0,5:45:00 AM,6:22:00 PM,21.09,0.0,0.0,0,0,26.6,41.0,238,6.37,8.599998,81.20001,7,Sri Lanka,Trincomalee,2011-06-08,6,2011,0.2
6/9/2011,1,33.7,26.7,29.5,36.9,28.9,31.6,5:45:00 AM,6:22:00 PM,22.02,0.0,0.0,0,0,27.2,46.4,237,6.46,8.599998,81.20001,7,Sri Lanka,Trincomalee,2011-06-09,6,2011,0.0
6/10/2011,1,34.3,26.7,29.7,36.5,28.6,31.3,5:46:00 AM,6:22:00 PM,22.91,0.0,0.0,0,0,28.8,46.4,239,6.86,8.599998,81.20001,7,Sri Lanka,Trincomalee,2011-06-10,6,2011,0.0
6/11/2011,1,34.4,26.7,30.0,36.9,28.6,32.0,5:46:00 AM,6:22:00 PM,22.94,0.0,0.0,0,0,25.3,40.7,239,6.84,8.599998,81.20001,7,Sri Lanka,Trincomalee,2011-06-11,6,2011,0.0
6/12/2011,51,33.2,26.9,29.5,35.2,28.7,31.3,5:46:00 AM,6:23:00 PM,15.55,0.1,0.1,0,1,27.4,43.2,239,5.48,8.599998,81.20001,7,Sri Lanka,Trincomalee,2011-06-12,6,2011,0.0
6/13/2011,51,34.4,26.8,29.6,36.8,28.0,31.2,5:46:00 AM,6:23:00 PM,22.65,0.1,0.1,0,1,30.3,50.4,241,6.78,8.599998,81.20001,7,Sri Lanka,Trincomalee,2011-06-13,6,2011,0.1
6/14/2011,51,32.5,26.5,29.0,32.9,27.8,29.8,5:46:00 AM,6:23:00 PM,20.8,0.2,0.2,0,1,35.8,60.1,244,6.54,8.599998,81.20001,7,Sri Lanka,Trincomalee,2011-06-14,6,2011,0.1
6/15/2011,1,34.1,27.0,29.6,34.4,28.2,30.5,5:46:00 AM,6:23:00 PM,18.69,0.0,0.0,0,0,31.4,50.0,246,6.53,8.599998,81.20001,7,Sri Lanka,Trincomalee,2011-06-15,6,2011,0.2
6/16/2011,2,34.5,26.8,29.9,35.8,28.2,31.0,5:47:00 AM,6:24:00 PM,23.45,0.0,0.0,0,0,31.6,54.4,245,7.33,8.599998,81.20001,7,Sri Lanka,Trincomalee,2011-06-16,6,2011,0.0
6/17/2011,2,33.8,26.9,29.8,34.5,28.3,30.5,5:47:00 AM,6:24:00 PM,23.27,0.0,0.0,0,0,32.9,55.4,245,7.45,8.599998,81.20001,7,Sri Lanka,Trincomalee,2011-06-17,6,2011,0.0
6/18/2011,1,34.6,27.2,30.0,35.4,28.5,31.2,5:47:00 AM,6:24:00 PM,22.28,0.0,0.0,0,0,29.5,52.9,244,7.18,8.599998,81.20001,7,Sri Lanka,Trincomalee,2011-06-18,6,2011,0.0
6/19/2011,1,35.3,27.0,30.3,36.9,28.5,31.6,5:47:00 AM,6:24:00 PM,24.97,0.0,0.0,0,0,29.5,48.6,245,7.72,8.599998,81.20001,7,Sri Lanka,Trincomalee,2011-06-19,6,2011,0.0
6/20/2011,1,35.4,26.9,30.3,37.5,28.3,32.0,5:47:00 AM,6:25:00 PM,24.35,0.0,0.0,0,0,28.9,45.4,242,7.46,8.599998,81.20001,7,Sri Lanka,Trincomalee,2011-06-20,6,2011,0.0
6/21/2011,1,35.1,26.9,30.2,40.5,28.3,33.3,5:48:00 AM,6:25:00 PM,24.57,0.0,0.0,0,0,27.4,45.4,238,6.58,8.599998,81.20001,7,Sri Lanka,Trincomalee,2011-06-21,6,2011,0.0
6/22/2011,0,35.0,26.6,30.1,36.2,28.3,31.4,5:48:00 AM,6:25:00 PM,24.76,0.0,0.0,0,0,28.8,49.0,243,7.54,8.599998,81.20001,7,Sri Lanka,Trincomalee,2011-06-22,6,2011,0.0
6/23/2011,1,34.4,26.5,30.0,37.6,28.7,32.5,5:48:00 AM,6:25:00 PM,22.86,0.0,0.0,0,0,24.1,42.5,240,6.49,8.599998,81.20001,7,Sri Lanka,Trincomalee,2011-06-23,6,2011,0.0
6/24/2011,51,35.2,26.8,30.0,39.1,28.8,32.4,5:48:00 AM,6:26:00 PM,22.1,0.3,0.3,0,2,27.1,43.9,243,6.5,8.599998,81.20001,7,Sri Lanka,Trincomalee,2011-06-24,6,2011,0.0
6/25/2011,51,35.0,26.9,29.7,38.2,28.7,31.7,5:49:00 AM,6:26:00 PM,22.28,0.2,0.2,0,1,27.6,47.2,245,6.53,8.599998,81.20001,7,Sri Lanka,Trincomalee,2011-06-25,6,2011,0.3
6/26/2011,2,35.1,26.8,30.0,37.7,28.6,31.9,5:49:00 AM,6:26:00 PM,21.55,0.0,0.0,0,0,26.7,42.8,244,6.73,8.599998,81.20001,7,Sri Lanka,Trincomalee,2011-06-26,6,2011,0.2
6/27/2011,51,35.0,27.1,29.8,38.3,28.6,31.7,5:49:00 AM,6:26:00 PM,23.25,0.2,0.2,0,1,29.4,47.2,250,6.84,8.599998,81.20001,7,Sri Lanka,Trincomalee,2011-06-27,6,2011,0.0
6/28/2011,2,35.4,27.2,30.3,39.1,28.8,32.6,5:49:00 AM,6:26:00 PM,22.91,0.0,0.0,0,0,26.3,42.5,248,6.79,8.599998,81.20001,7,Sri Lanka,Trincomalee,2011-06-28,6,2011,0.2
6/29/2011,61,34.4,27.0,29.5,40.5,29.2,33.4,5:49:00 AM,6:26:00 PM,22.04,2.1,2.1,0,3,22.7,39.2,242,5.6,8.599998,81.20001,7,Sri Lanka,Trincomalee,2011-06-29,6,2011,0.0
6/30/2011,61,34.7,26.8,29.7,40.8,28.7,33.4,5:50:00 AM,6:27:00 PM,23.4,2.3,2.3,0,2,22.1,35.6,227,5.85,8.599998,81.20001,7,Sri Lanka,Trincomalee,2011-06-30,6,2011,2.1
7/1/2011,2,34.7,26.6,29.8,39.8,28.7,32.9,5:50:00 AM,6:27:00 PM,22.51,0.0,0.0,0,0,23.2,40.0,242,6.02,8.599998,81.20001,7,Sri Lanka,Trincomalee,2011-07-01,7,2011,2.3
7/2/2011,51,33.8,26.7,29.1,38.5,29.1,32.8,5:50:00 AM,6:27:00 PM,20.91,1.1,1.1,0,6,21.7,40.0,250,5.3,8.599998,81.20001,7,Sri Lanka,Trincomalee,2011-07-02,7,2011,0.0
7/3/2011,2,33.2,26.7,29.5,36.8,28.4,32.8,5:50:00 AM,6:27:00 PM,17.32,0.0,0.0,0,0,22.4,39.2,246,4.9,8.599998,81.20001,7,Sri Lanka,Trincomalee,2011-07-03,7,2011,1.1
7/4/2011,55,34.5,26.6,29.6,39.4,28.3,33.0,5:51:00 AM,6:27:00 PM,22.92,1.7,1.7,0,3,23.7,38.9,247,5.94,8.599998,81.20001,7,Sri Lanka,Trincomalee,2011-07-04,7,2011,0.0
7/5/2011,53,32.5,26.2,28.6,35.4,27.7,30.8,5:51:00 AM,6:27:00 PM,16.2,0.7,0.7,0,2,28.1,45.0,241,5.01,8.599998,81.20001,7,Sri Lanka,Trincomalee,2011-07-05,7,2011,1.7
7/6/2011,51,33.4,26.2,29.0,36.5,27.8,31.2,5:51:00 AM,6:27:00 PM,16.87,0.2,0.2,0,1,28.4,49.3,235,5.23,8.599998,81.20001,7,Sri Lanka,Trincomalee,2011-07-06,7,2011,0.7
7/7/2011,51,34.3,26.5,29.6,39.7,29.4,33.1,5:51:00 AM,6:27:00 PM,21.86,0.1,0.1,0,1,20.6,34.6,236,5.54,8.599998,81.20001,7,Sri Lanka,Trincomalee,2011-07-07,7,2011,0.2
7/8/2011,63,34.4,26.5,28.9,39.9,28.9,32.7,5:52:00 AM,6:27:00 PM,22.82,5.1,5.1,0,4,21.9,42.1,241,5.58,8.599998,81.20001,7,Sri Lanka,Trincomalee,2011-07-08,7,2011,0.1
7/9/2011,63,33.4,26.2,28.4,39.3,28.5,32.3,5:52:00 AM,6:28:00 PM,21.86,11.6,11.6,0,4,22.9,37.4,245,5.24,8.599998,81.20001,7,Sri Lanka,Trincomalee,2011-07-09,7,2011,5.1
7/10/2011,55,33.5,26.2,28.7,38.2,27.8,31.4,5:52:00 AM,6:28:00 PM,22.66,1.7,1.7,0,3,28.2,45.0,243,5.82,8.599998,81.20001,7,Sri Lanka,Trincomalee,2011-07-10,7,2011,11.6
7/11/2011,53,33.0,26.4,28.6,35.7,27.5,30.2,5:52:00 AM,6:28:00 PM,21.52,0.6,0.6,0,1,30.1,50.4,247,6.09,8.599998,81.20001,7,Sri Lanka,Trincomalee,2011-07-11,7,2011,1.7
7/12/2011,2,32.4,26.2,28.5,34.4,27.3,30.0,5:53:00 AM,6:28:00 PM,20.66,0.0,0.0,0,0,29.8,53.6,246,5.94,8.599998,81.20001,7,Sri Lanka,Trincomalee,2011-07-12,7,2011,0.6
7/13/2011,1,32.6,26.2,28.5,34.2,27.5,29.8,5:53:00 AM,6:28:00 PM,19.68,0.0,0.0,0,0,30.1,47.2,241,5.96,8.599998,81.20001,7,Sri Lanka,Trincomalee,2011-07-13,7,2011,0.0
7/14/2011,51,32.6,26.1,28.7,34.2,27.0,29.5,5:53:00 AM,6:28:00 PM,23.41,0.1,0.1,0,1,32.6,58.3,243,6.8,8.599998,81.20001,7,Sri Lanka,Trincomalee,2011-07-14,7,2011,0.0
7/15/2011,2,32.9,26.0,28.5,34.0,26.8,29.7,5:53:00 AM,6:28:00 PM,21.59,0.0,0.0,0,0,31.6,50.4,243,6.26,8.599998,81.20001,7,Sri Lanka,Trincomalee,2011-07-15,7,2011,0.1
7/16/2011,3,31.5,25.7,28.0,32.1,26.7,29.0,5:53:00 AM,6:28:00 PM,18.91,0.0,0.0,0,0,33.7,54.7,243,5.51,8.599998,81.20001,7,Sri Lanka,Trincomalee,2011-07-16,7,2011,0.0
7/17/2011,3,32.5,26.3,28.7,34.4,28.1,30.4,5:54:00 AM,6:28:00 PM,20.71,0.0,0.0,0,0,27.9,49.3,242,6.01,8.599998,81.20001,7,Sri Lanka,Trincomalee,2011-07-17,7,2011,0.0
7/18/2011,2,33.7,26.3,29.2,36.2,28.4,31.1,5:54:00 AM,6:28:00 PM,20.16,0.0,0.0,0,0,25.4,41.4,247,6.12,8.599998,81.20001,7,Sri Lanka,Trincomalee,2011-07-18,7,2011,0.0
7/19/2011,2,34.7,26.5,29.8,39.1,28.5,32.6,5:54:00 AM,6:28:00 PM,23.21,0.0,0.0,0,0,26.9,42.8,235,6.25,8.599998,81.20001,7,Sri Lanka,Trincomalee,2011-07-19,7,2011,0.0
7/20/2011,2,33.4,26.7,29.1,36.2,28.0,30.8,5:54:00 AM,6:28:00 PM,18.73,0.0,0.0,0,0,30.1,47.9,237,5.98,8.599998,81.20001,7,Sri Lanka,Trincomalee,2011-07-20,7,2011,0.0
7/21/2011,3,33.3,26.6,29.2,34.4,27.8,30.4,5:54:00 AM,6:27:00 PM,20.5,0.0,0.0,0,0,28.7,47.9,242,6.46,8.599998,81.20001,7,Sri Lanka,Trincomalee,2011-07-21,7,2011,0.0
7/22/2011,3,34.2,26.5,29.5,36.9,27.8,30.8,5:55:00 AM,6:27:00 PM,21.96,0.0,0.0,0,0,29.6,50.0,246,6.74,8.599998,81.20001,7,Sri Lanka,Trincomalee,2011-07-22,7,2011,0.0
7/23/2011,51,33.6,26.6,29.4,35.9,27.9,31.0,5:55:00 AM,6:27:00 PM,21.65,0.1,0.1,0,1,29.4,49.7,247,6.53,8.599998,81.20001,7,Sri Lanka,Trincomalee,2011-07-23,7,2011,0.0
7/24/2011,51,34.2,26.2,28.9,37.9,28.4,31.4,5:55:00 AM,6:27:00 PM,21.49,0.7,0.7,0,2,25.5,45.7,244,5.92,8.599998,81.20001,7,Sri Lanka,Trincomalee,2011-07-24,7,2011,0.1
7/25/2011,63,33.1,26.0,28.0,37.0,27.9,30.9,5:55:00 AM,6:27:00 PM,17.12,7.1,7.1,0,3,28.7,49.3,242,4.63,8.599998,81.20001,7,Sri Lanka,Trincomalee,2011-07-25,7,2011,0.7
7/26/2011,3,33.4,26.0,28.8,36.9,28.1,31.3,5:55:00 AM,6:27:00 PM,20.67,0.0,0.0,0,0,24.7,45.4,241,5.5,8.599998,81.20001,7,Sri Lanka,Trincomalee,2011-07-26,7,2011,7.1
7/27/2011,2,33.9,26.0,28.8,37.2,27.5,30.7,5:55:00 AM,6:27:00 PM,22.89,0.0,0.0,0,0,28.3,46.1,246,6.4,8.599998,81.20001,7,Sri Lanka,Trincomalee,2011-07-27,7,2011,0.0
7/28/2011,3,32.9,26.2,28.8,34.2,27.4,29.9,5:56:00 AM,6:27:00 PM,17.9,0.0,0.0,0,0,30.2,50.0,247,5.97,8.599998,81.20001,7,Sri Lanka,Trincomalee,2011-07-28,7,2011,0.0
7/29/2011,51,31.7,25.9,28.1,32.5,27.3,29.1,5:56:00 AM,6:26:00 PM,14.82,1.1,1.1,0,5,28.5,46.8,240,5.13,8.599998,81.20001,7,Sri Lanka,Trincomalee,2011-07-29,7,2011,0.0
7/30/2011,3,32.8,25.9,28.7,33.9,27.1,29.5,5:56:00 AM,6:26:00 PM,18.81,0.0,0.0,0,0,30.4,49.3,242,6.12,8.599998,81.20001,7,Sri Lanka,Trincomalee,2011-07-30,7,2011,1.1
7/31/2011,2,33.6,26.3,29.3,34.0,27.6,30.3,5:56:00 AM,6:26:00 PM,20.33,0.0,0.0,0,0,27.7,43.9,245,6.74,8.599998,81.20001,7,Sri Lanka,Trincomalee,2011-07-31,7,2011,0.0
8/1/2011,51,34.3,26.4,29.5,38.5,27.6,31.5,5:56:00 AM,6:26:00 PM,21.99,0.4,0.4,0,2,28.8,46.8,250,6.47,8.599998,81.20001,7,Sri Lanka,Trincomalee,2011-08-01,8,2011,0.0
8/2/2011,1,34.2,26.5,29.6,36.0,27.4,30.6,5:56:00 AM,6:25:00 PM,23.86,0.0,0.0,0,0,30.2,48.6,243,7.38,8.599998,81.20001,7,Sri Lanka,Trincomalee,2011-08-02,8,2011,0.4
8/3/2011,2,33.6,26.3,29.1,36.4,28.1,30.8,5:56:00 AM,6:25:00 PM,20.26,0.0,0.0,0,0,26.1,47.9,237,6.24,8.599998,81.20001,7,Sri Lanka,Trincomalee,2011-08-03,8,2011,0.0
8/4/2011,1,34.8,26.1,29.9,37.4,27.9,31.9,5:56:00 AM,6:25:00 PM,23.15,0.0,0.0,0,0,25.8,44.3,239,6.7,8.599998,81.20001,7,Sri Lanka,Trincomalee,2011-08-04,8,2011,0.0
8/5/2011,51,33.9,25.6,29.1,36.9,26.9,31.0,5:56:00 AM,6:25:00 PM,21.73,0.1,0.1,0,1,29.9,45.0,238,6.28,8.599998,81.20001,7,Sri Lanka,Trincomalee,2011-08-05,8,2011,0.0
8/6/2011,51,33.0,25.7,28.6,35.0,26.9,29.8,5:57:00 AM,6:24:00 PM,19.42,0.2,0.2,0,1,33.2,50.0,243,5.94,8.599998,81.20001,7,Sri Lanka,Trincomalee,2011-08-06,8,2011,0.1
8/7/2011,2,34.9,26.4,29.7,37.9,27.9,31.6,5:57:00 AM,6:24:00 PM,21.95,0.0,0.0,0,0,28.2,50.4,243,6.49,8.599998,81.20001,7,Sri Lanka,Trincomalee,2011-08-07,8,2011,0.2
8/8/2011,51,35.2,26.4,29.6,38.5,27.8,31.4,5:57:00 AM,6:24:00 PM,22.95,0.3,0.3,0,2,25.7,43.9,240,6.77,8.599998,81.20001,7,Sri Lanka,Trincomalee,2011-08-08,8,2011,0.0
8/9/2011,51,33.9,26.4,29.3,36.0,28.3,31.2,5:57:00 AM,6:24:00 PM,20.73,0.1,0.1,0,1,28.9,49.0,238,6.21,8.599998,81.20001,7,Sri Lanka,Trincomalee,2011-08-09,8,2011,0.3
8/10/2011,3,34.9,26.5,29.7,38.9,28.1,32.3,5:57:00 AM,6:23:00 PM,21.5,0.0,0.0,0,0,25.1,39.6,230,5.96,8.599998,81.20001,7,Sri Lanka,Trincomalee,2011-08-10,8,2011,0.1
8/11/2011,51,35.0,26.4,29.5,39.0,28.2,32.0,5:57:00 AM,6:23:00 PM,22.26,0.4,0.4,0,2,24.4,41.4,239,6.32,8.599998,81.20001,7,Sri Lanka,Trincomalee,2011-08-11,8,2011,0.0
8/12/2011,65,34.3,26.2,28.5,39.7,27.9,31.9,5:57:00 AM,6:22:00 PM,21.3,15.7,15.7,0,4,25.2,39.2,243,5.38,8.599998,81.20001,7,Sri Lanka,Trincomalee,2011-08-12,8,2011,0.4
8/13/2011,61,32.8,26.1,28.3,37.9,28.3,31.4,5:57:00 AM,6:22:00 PM,21.39,2.5,2.5,0,3,23.7,41.8,241,5.34,8.599998,81.20001,7,Sri Lanka,Trincomalee,2011-08-13,8,2011,15.7
8/14/2011,51,32.9,25.9,28.6,38.2,28.8,32.7,5:57:00 AM,6:22:00 PM,21.51,0.8,0.8,0,3,17.7,32.8,239,5.06,8.599998,81.20001,7,Sri Lanka,Trincomalee,2011-08-14,8,2011,2.5
8/15/2011,51,31.8,26.0,28.4,35.2,29.1,31.7,5:57:00 AM,6:21:00 PM,17.32,0.2,0.2,0,2,16.0,29.9,207,4.53,8.599998,81.20001,7,Sri Lanka,Trincomalee,2011-08-15,8,2011,0.8
8/16/2011,51,30.8,25.8,27.6,34.2,28.7,30.9,5:57:00 AM,6:21:00 PM,12.46,0.8,0.8,0,3,23.3,39.2,244,3.5,8.599998,81.20001,7,Sri Lanka,Trincomalee,2011-08-16,8,2011,0.2
8/17/2011,63,30.8,25.2,26.9,35.9,27.9,30.5,5:57:00 AM,6:21:00 PM,16.4,13.9,13.9,0,8,23.1,38.5,234,3.91,8.599998,81.20001,7,Sri Lanka,Trincomalee,2011-08-17,8,2011,0.8
8/18/2011,51,31.3,25.8,28.3,34.6,27.6,30.5,5:57:00 AM,6:20:00 PM,19.19,0.1,0.1,0,1,28.3,45.7,248,5.18,8.599998,81.20001,7,Sri Lanka,Trincomalee,2011-08-18,8,2011,13.9
8/19/2011,61,32.9,25.9,28.1,37.6,27.8,31.2,5:57:00 AM,6:20:00 PM,22.9,3.4,3.4,0,3,23.0,41.4,250,5.53,8.599998,81.20001,7,Sri Lanka,Trincomalee,2011-08-19,8,2011,0.1
8/20/2011,51,33.3,26.0,29.0,37.6,28.0,31.7,5:57:00 AM,6:19:00 PM,23.4,0.2,0.2,0,1,23.2,42.5,240,6.08,8.599998,81.20001,7,Sri Lanka,Trincomalee,2011-08-20,8,2011,3.4
8/21/2011,1,33.1,26.2,28.9,36.8,28.1,31.3,5:57:00 AM,6:19:00 PM,20.5,0.0,0.0,0,0,23.0,37.1,235,5.72,8.599998,81.20001,7,Sri Lanka,Trincomalee,2011-08-21,8,2011,0.2
8/22/2011,51,32.9,25.9,28.3,36.7,27.8,30.8,5:57:00 AM,6:18:00 PM,21.01,0.6,0.6,0,3,24.7,37.8,229,5.57,8.599998,81.20001,7,Sri Lanka,Trincomalee,2011-08-22,8,2011,0.0
8/23/2011,55,33.2,25.8,28.2,37.3,27.1,30.5,5:57:00 AM,6:18:00 PM,20.45,2.2,2.2,0,3,26.5,42.5,227,5.56,8.599998,81.20001,7,Sri Lanka,Trincomalee,2011-08-23,8,2011,0.6
8/24/2011,3,31.7,25.7,28.2,32.7,27.0,29.2,5:57:00 AM,6:17:00 PM,18.83,0.0,0.0,0,0,33.2,52.2,232,5.78,8.599998,81.20001,7,Sri Lanka,Trincomalee,2011-08-24,8,2011,2.2
8/25/2011,3,33.4,26.0,28.6,36.6,27.8,30.6,5:57:00 AM,6:17:00 PM,21.69,0.0,0.0,0,0,24.0,43.6,237,6.12,8.599998,81.20001,7,Sri Lanka,Trincomalee,2011-08-25,8,2011,0.0
